\set ECHO none
--Testcase 1:
SET datestyle = ISO;
--Testcase 2:
SET timezone = 'UTC';
--Testcase 3:
DELETE FROM pg_spd_node_info;
--Testcase 4:
CREATE EXTENSION pgspider_core_fdw;
--Testcase 5:
CREATE SERVER pgspider_svr FOREIGN DATA WRAPPER pgspider_core_fdw OPTIONS (host :PGSPIDER_SERVER1);
--Testcase 6:
CREATE USER MAPPING FOR CURRENT_USER SERVER pgspider_svr;
-- Extensions
--Testcase 7:
CREATE EXTENSION postgres_fdw;
--Testcase 8:
CREATE SERVER postgres_svr FOREIGN DATA WRAPPER postgres_fdw OPTIONS (host :POSTGRES_SERVER, port :POSTGRES_PORT, dbname 'pg_modify_db');
--Testcase 9:
CREATE USER mapping for public SERVER postgres_svr OPTIONS(user :POSTGRES_USER, password :POSTGRES_PASS);
--Testcase 10:
CREATE SERVER postgres_svr_1 FOREIGN DATA WRAPPER postgres_fdw OPTIONS (host :POSTGRES_1_SERVER, port :POSTGRES_1_PORT, dbname 'pg_modify_db');
--Testcase 11:
CREATE USER mapping for public SERVER postgres_svr_1 OPTIONS(user :POSTGRES_1_USER, password :POSTGRES_1_PASS);
--Testcase 12:
CREATE SERVER postgres_svr_2 FOREIGN DATA WRAPPER postgres_fdw OPTIONS (host :POSTGRES_2_SERVER, port :POSTGRES_2_PORT, dbname 'pg_modify_db');
--Testcase 13:
CREATE USER mapping for public SERVER postgres_svr_2 OPTIONS(user :POSTGRES_2_USER, password :POSTGRES_2_PASS);
--Testcase 14:
CREATE FOREIGN TABLE tntbl4 (c1 int, c2 text, c3 boolean, c4 double precision, c5 bigint, c6 char(255), c7 varchar(255), c8 float8, c9 smallint, c10 timestamp, c11 timestamp with time zone, c12 date, c13 json, c14 jsonb, c15 uuid, c16 point, c17 bytea, c18 bit(10), c19 varbit(10), c20 interval, __spd_url text) SERVER pgspider_svr;
-- Foreign tables
--Testcase 15:
CREATE FOREIGN TABLE tntbl4__postgres_svr__0 (c1 int, c2 text, c3 boolean, c4 double precision, c5 bigint, c6 char(255), c7 varchar(255), c8 float8, c9 smallint, c10 timestamp, c11 timestamp with time zone, c12 date, c13 json, c14 jsonb, c15 uuid, c16 point, c17 bytea, c18 bit(10), c19 varbit(10), c20 interval) SERVER postgres_svr OPTIONS (table_name 'tntbl4');
--Testcase 16:
CREATE FOREIGN TABLE tntbl4__postgres_svr_2__0 (c1 int, c2 text, c3 boolean, c4 double precision, c5 bigint, c6 char(255), c7 varchar(255), c8 float8, c9 smallint, c10 timestamp, c11 timestamp with time zone, c12 date, c13 json, c14 jsonb, c15 uuid, c16 point, c17 bytea, c18 bit(10), c19 varbit(10), c20 interval) SERVER postgres_svr_2 OPTIONS (table_name 'tntbl4');
-- Reset data of remote table before test
DELETE FROM tntbl4__postgres_svr__0;
DELETE FROM tntbl4__postgres_svr_2__0;
INSERT INTO tntbl4__postgres_svr__0 VALUES (10, 'text', true, 10.0, 1000, 'char array', 'varchar array', -1.0, 12, '2004-10-19 10:23:54', '2004-10-19 10:23:54+02', '2001-01-01', '{"product": "test","quantity": 1}', '{"name": "paintings", "tags": ["Scene", "Portrait"], "finished": true }', '2f404849-f62c-4234-b0c8-e230bd694045', point '(1,-45)', E'\\xa7a8a9aaabacadaeaf', B'1111111111', B'10101', interval '1 year 3 hours 20 minutes');
INSERT INTO tntbl4__postgres_svr_2__0 VALUES (20, 'texttext', false, -10.0, -1000, 'char array', 'varchar array', 1.0, 1, '2005-10-19 10:23:54', '2005-10-19 10:23:54+02', '2001-01-01', '{"product": "sample","quantity": 1}', '{"name": "paintings", "tags": ["Scene", "Portrait"], "finished": false }', '2f404849-f62c-4234-b0c8-e230bd694045', point '(1,-45)', E'\\xa7a8a9aaabacadaeaf', B'1111111111', B'10101', interval '1 year 3 hours 20 minutes');
--Testcase 17:
SELECT * FROM tntbl4 ORDER BY c1, c2, c3, c4, c5;
 c1 |    c2    | c3 | c4  |  c5   |                                                                                                                               c6                                                                                                                                |      c7       | c8 | c9 |         c10         |          c11           |    c12     |                 c13                 |                                   c14                                   |                 c15                  |   c16   |         c17          |    c18     |  c19  |           c20            |    __spd_url     
----+----------+----+-----+-------+-----------------------------------------------------------------------------------------------------------------------------------------------------------------------------------------------------------------------------------------------------------------+---------------+----+----+---------------------+------------------------+------------+-------------------------------------+-------------------------------------------------------------------------+--------------------------------------+---------+----------------------+------------+-------+--------------------------+------------------
 10 | text     | t  |  10 |  1000 | char array                                                                                                                                                                                                                                                      | varchar array | -1 | 12 | 2004-10-19 10:23:54 | 2004-10-19 08:23:54+00 | 2001-01-01 | {"product": "test","quantity": 1}   | {"name": "paintings", "tags": ["Scene", "Portrait"], "finished": true}  | 2f404849-f62c-4234-b0c8-e230bd694045 | (1,-45) | \xa7a8a9aaabacadaeaf | 1111111111 | 10101 | @ 1 year 3 hours 20 mins | /postgres_svr/
 20 | texttext | f  | -10 | -1000 | char array                                                                                                                                                                                                                                                      | varchar array |  1 |  1 | 2005-10-19 10:23:54 | 2005-10-19 08:23:54+00 | 2001-01-01 | {"product": "sample","quantity": 1} | {"name": "paintings", "tags": ["Scene", "Portrait"], "finished": false} | 2f404849-f62c-4234-b0c8-e230bd694045 | (1,-45) | \xa7a8a9aaabacadaeaf | 1111111111 | 10101 | @ 1 year 3 hours 20 mins | /postgres_svr_2/
(2 rows)

-----------------------------------------------------------------------------------
-- *** Start test for tntbl4 *** --
--
-- insert with DEFAULT in the target_list
--
--Testcase 18:
INSERT INTO tntbl4 (c1, c2, c3, c4, c5, c6, c7, c8, c9, c10, c11, c12, c13, c14, c15, c16, c17, c18, c19, c20) VALUES (DEFAULT, DEFAULT, DEFAULT, DEFAULT, DEFAULT, DEFAULT, DEFAULT, DEFAULT, DEFAULT, DEFAULT, DEFAULT, DEFAULT, DEFAULT, DEFAULT, DEFAULT, DEFAULT, DEFAULT, DEFAULT, DEFAULT, DEFAULT);
--Testcase 19:
INSERT INTO tntbl4 (c1, c2, c3) VALUES (3, DEFAULT, DEFAULT);
--Testcase 20:
INSERT INTO tntbl4 (c1, c2, c3) VALUES (4, 'ANC#$', DEFAULT);
--Testcase 21:
INSERT INTO tntbl4 VALUES (5, DEFAULT, true, 10.0, 1000, 'char array', 'char varying', 100.0, 127, '2004-10-19 10:23:54', '2004-10-19 10:23:54+02', '0001-01-01', '{ "customer": "John Does"}', '{"tags": ["tag1", "tag2"], "finished": true }', '2f404849-f62c-4234-b0c8-e230bd694045', point '(1,-45)', E'\\xa7a8a9aaabacadaeaf', B'1111111111', B'10101', interval '6 years 5 months 4 days 3 hours 2 minutes 1 second');
--Testcase 22:
INSERT INTO tntbl4 VALUES (6, 'test', false, DEFAULT, 2000, 'test', 'test', 200.0, 0);
--Testcase 23:
SELECT * FROM tntbl4 ORDER BY c1, c2, c3, c4, c5;
 c1 |    c2    | c3 | c4  |  c5   |                                                                                                                               c6                                                                                                                                |      c7       | c8  | c9  |         c10         |          c11           |    c12     |                 c13                 |                                   c14                                   |                 c15                  |   c16   |         c17          |    c18     |  c19  |                     c20                      |    __spd_url     
----+----------+----+-----+-------+-----------------------------------------------------------------------------------------------------------------------------------------------------------------------------------------------------------------------------------------------------------------+---------------+-----+-----+---------------------+------------------------+------------+-------------------------------------+-------------------------------------------------------------------------+--------------------------------------+---------+----------------------+------------+-------+----------------------------------------------+------------------
  3 |          |    |     |       |                                                                                                                                                                                                                                                                 |               |     |     |                     |                        |            |                                     |                                                                         |                                      |         |                      |            |       |                                              | /postgres_svr/
  4 | ANC#$    |    |     |       |                                                                                                                                                                                                                                                                 |               |     |     |                     |                        |            |                                     |                                                                         |                                      |         |                      |            |       |                                              | /postgres_svr_2/
  5 |          | t  |  10 |  1000 | char array                                                                                                                                                                                                                                                      | char varying  | 100 | 127 | 2004-10-19 10:23:54 | 2004-10-19 08:23:54+00 | 0001-01-01 | { "customer": "John Does"}          | {"tags": ["tag1", "tag2"], "finished": true}                            | 2f404849-f62c-4234-b0c8-e230bd694045 | (1,-45) | \xa7a8a9aaabacadaeaf | 1111111111 | 10101 | @ 6 years 5 mons 4 days 3 hours 2 mins 1 sec | /postgres_svr/
  6 | test     | f  |     |  2000 | test                                                                                                                                                                                                                                                            | test          | 200 |   0 |                     |                        |            |                                     |                                                                         |                                      |         |                      |            |       |                                              | /postgres_svr_2/
 10 | text     | t  |  10 |  1000 | char array                                                                                                                                                                                                                                                      | varchar array |  -1 |  12 | 2004-10-19 10:23:54 | 2004-10-19 08:23:54+00 | 2001-01-01 | {"product": "test","quantity": 1}   | {"name": "paintings", "tags": ["Scene", "Portrait"], "finished": true}  | 2f404849-f62c-4234-b0c8-e230bd694045 | (1,-45) | \xa7a8a9aaabacadaeaf | 1111111111 | 10101 | @ 1 year 3 hours 20 mins                     | /postgres_svr/
 20 | texttext | f  | -10 | -1000 | char array                                                                                                                                                                                                                                                      | varchar array |   1 |   1 | 2005-10-19 10:23:54 | 2005-10-19 08:23:54+00 | 2001-01-01 | {"product": "sample","quantity": 1} | {"name": "paintings", "tags": ["Scene", "Portrait"], "finished": false} | 2f404849-f62c-4234-b0c8-e230bd694045 | (1,-45) | \xa7a8a9aaabacadaeaf | 1111111111 | 10101 | @ 1 year 3 hours 20 mins                     | /postgres_svr_2/
    |          |    |     |       |                                                                                                                                                                                                                                                                 |               |     |     |                     |                        |            |                                     |                                                                         |                                      |         |                      |            |       |                                              | /postgres_svr_2/
(7 rows)

--
-- insert with similar expression / target_list VALUES (all fail)
--
--Testcase 24:
INSERT INTO tntbl4 (c1, c2, c3, c4, c5, c6, c7, c8, c9, c10, c11, c12, c13, c14, c15, c16, c17, c18, c19, c20) VALUES (DEFAULT, DEFAULT, DEFAULT, DEFAULT, DEFAULT, DEFAULT, DEFAULT, DEFAULT, DEFAULT, DEFAULT, DEFAULT, DEFAULT, DEFAULT, DEFAULT, DEFAULT, DEFAULT, DEFAULT, DEFAULT, DEFAULT);
ERROR:  INSERT has more target columns than expressions
LINE 1: ...c10, c11, c12, c13, c14, c15, c16, c17, c18, c19, c20) VALUE...
                                                             ^
--Testcase 25:
INSERT INTO tntbl4 (c1, c2, c3) VALUES (1, 'ex');
ERROR:  INSERT has more target columns than expressions
LINE 1: INSERT INTO tntbl4 (c1, c2, c3) VALUES (1, 'ex');
                                    ^
--Testcase 26:
INSERT INTO tntbl4 (c1) VALUES (1, 2);
ERROR:  INSERT has more expressions than target columns
LINE 1: INSERT INTO tntbl4 (c1) VALUES (1, 2);
                                           ^
--Testcase 27:
INSERT INTO tntbl4 (c1) VALUES (DEFAULT, DEFAULT);
ERROR:  INSERT has more expressions than target columns
LINE 1: INSERT INTO tntbl4 (c1) VALUES (DEFAULT, DEFAULT);
                                                 ^
--Testcase 28:
SELECT * FROM tntbl4 ORDER BY c1, c2, c3, c4, c5;
 c1 |    c2    | c3 | c4  |  c5   |                                                                                                                               c6                                                                                                                                |      c7       | c8  | c9  |         c10         |          c11           |    c12     |                 c13                 |                                   c14                                   |                 c15                  |   c16   |         c17          |    c18     |  c19  |                     c20                      |    __spd_url     
----+----------+----+-----+-------+-----------------------------------------------------------------------------------------------------------------------------------------------------------------------------------------------------------------------------------------------------------------+---------------+-----+-----+---------------------+------------------------+------------+-------------------------------------+-------------------------------------------------------------------------+--------------------------------------+---------+----------------------+------------+-------+----------------------------------------------+------------------
  3 |          |    |     |       |                                                                                                                                                                                                                                                                 |               |     |     |                     |                        |            |                                     |                                                                         |                                      |         |                      |            |       |                                              | /postgres_svr/
  4 | ANC#$    |    |     |       |                                                                                                                                                                                                                                                                 |               |     |     |                     |                        |            |                                     |                                                                         |                                      |         |                      |            |       |                                              | /postgres_svr_2/
  5 |          | t  |  10 |  1000 | char array                                                                                                                                                                                                                                                      | char varying  | 100 | 127 | 2004-10-19 10:23:54 | 2004-10-19 08:23:54+00 | 0001-01-01 | { "customer": "John Does"}          | {"tags": ["tag1", "tag2"], "finished": true}                            | 2f404849-f62c-4234-b0c8-e230bd694045 | (1,-45) | \xa7a8a9aaabacadaeaf | 1111111111 | 10101 | @ 6 years 5 mons 4 days 3 hours 2 mins 1 sec | /postgres_svr/
  6 | test     | f  |     |  2000 | test                                                                                                                                                                                                                                                            | test          | 200 |   0 |                     |                        |            |                                     |                                                                         |                                      |         |                      |            |       |                                              | /postgres_svr_2/
 10 | text     | t  |  10 |  1000 | char array                                                                                                                                                                                                                                                      | varchar array |  -1 |  12 | 2004-10-19 10:23:54 | 2004-10-19 08:23:54+00 | 2001-01-01 | {"product": "test","quantity": 1}   | {"name": "paintings", "tags": ["Scene", "Portrait"], "finished": true}  | 2f404849-f62c-4234-b0c8-e230bd694045 | (1,-45) | \xa7a8a9aaabacadaeaf | 1111111111 | 10101 | @ 1 year 3 hours 20 mins                     | /postgres_svr/
 20 | texttext | f  | -10 | -1000 | char array                                                                                                                                                                                                                                                      | varchar array |   1 |   1 | 2005-10-19 10:23:54 | 2005-10-19 08:23:54+00 | 2001-01-01 | {"product": "sample","quantity": 1} | {"name": "paintings", "tags": ["Scene", "Portrait"], "finished": false} | 2f404849-f62c-4234-b0c8-e230bd694045 | (1,-45) | \xa7a8a9aaabacadaeaf | 1111111111 | 10101 | @ 1 year 3 hours 20 mins                     | /postgres_svr_2/
    |          |    |     |       |                                                                                                                                                                                                                                                                 |               |     |     |                     |                        |            |                                     |                                                                         |                                      |         |                      |            |       |                                              | /postgres_svr_2/
(7 rows)

--
-- VALUES test
--
--Testcase 29:
INSERT INTO tntbl4 VALUES(1, '40', true, 2.0, 2000, 'value 1'), (-1, DEFAULT, true, 4.0, 4000, 'value 2'),
    ((SELECT 20), 'fun!', false, (SELECT i FROM (VALUES(3.0)) as foo (i)), 3000, 'VALUES are fun!');
--Testcase 30:
SELECT * FROM tntbl4 ORDER BY c1, c2, c3, c4, c5;
 c1 |    c2    | c3 | c4  |  c5   |                                                                                                                               c6                                                                                                                                |      c7       | c8  | c9  |         c10         |          c11           |    c12     |                 c13                 |                                   c14                                   |                 c15                  |   c16   |         c17          |    c18     |  c19  |                     c20                      |    __spd_url     
----+----------+----+-----+-------+-----------------------------------------------------------------------------------------------------------------------------------------------------------------------------------------------------------------------------------------------------------------+---------------+-----+-----+---------------------+------------------------+------------+-------------------------------------+-------------------------------------------------------------------------+--------------------------------------+---------+----------------------+------------+-------+----------------------------------------------+------------------
 -1 |          | t  |   4 |  4000 | value 2                                                                                                                                                                                                                                                         |               |     |     |                     |                        |            |                                     |                                                                         |                                      |         |                      |            |       |                                              | /postgres_svr_2/
  1 | 40       | t  |   2 |  2000 | value 1                                                                                                                                                                                                                                                         |               |     |     |                     |                        |            |                                     |                                                                         |                                      |         |                      |            |       |                                              | /postgres_svr/
  3 |          |    |     |       |                                                                                                                                                                                                                                                                 |               |     |     |                     |                        |            |                                     |                                                                         |                                      |         |                      |            |       |                                              | /postgres_svr/
  4 | ANC#$    |    |     |       |                                                                                                                                                                                                                                                                 |               |     |     |                     |                        |            |                                     |                                                                         |                                      |         |                      |            |       |                                              | /postgres_svr_2/
  5 |          | t  |  10 |  1000 | char array                                                                                                                                                                                                                                                      | char varying  | 100 | 127 | 2004-10-19 10:23:54 | 2004-10-19 08:23:54+00 | 0001-01-01 | { "customer": "John Does"}          | {"tags": ["tag1", "tag2"], "finished": true}                            | 2f404849-f62c-4234-b0c8-e230bd694045 | (1,-45) | \xa7a8a9aaabacadaeaf | 1111111111 | 10101 | @ 6 years 5 mons 4 days 3 hours 2 mins 1 sec | /postgres_svr/
  6 | test     | f  |     |  2000 | test                                                                                                                                                                                                                                                            | test          | 200 |   0 |                     |                        |            |                                     |                                                                         |                                      |         |                      |            |       |                                              | /postgres_svr_2/
 10 | text     | t  |  10 |  1000 | char array                                                                                                                                                                                                                                                      | varchar array |  -1 |  12 | 2004-10-19 10:23:54 | 2004-10-19 08:23:54+00 | 2001-01-01 | {"product": "test","quantity": 1}   | {"name": "paintings", "tags": ["Scene", "Portrait"], "finished": true}  | 2f404849-f62c-4234-b0c8-e230bd694045 | (1,-45) | \xa7a8a9aaabacadaeaf | 1111111111 | 10101 | @ 1 year 3 hours 20 mins                     | /postgres_svr/
 20 | fun!     | f  |   3 |  3000 | VALUES are fun!                                                                                                                                                                                                                                                 |               |     |     |                     |                        |            |                                     |                                                                         |                                      |         |                      |            |       |                                              | /postgres_svr/
 20 | texttext | f  | -10 | -1000 | char array                                                                                                                                                                                                                                                      | varchar array |   1 |   1 | 2005-10-19 10:23:54 | 2005-10-19 08:23:54+00 | 2001-01-01 | {"product": "sample","quantity": 1} | {"name": "paintings", "tags": ["Scene", "Portrait"], "finished": false} | 2f404849-f62c-4234-b0c8-e230bd694045 | (1,-45) | \xa7a8a9aaabacadaeaf | 1111111111 | 10101 | @ 1 year 3 hours 20 mins                     | /postgres_svr_2/
    |          |    |     |       |                                                                                                                                                                                                                                                                 |               |     |     |                     |                        |            |                                     |                                                                         |                                      |         |                      |            |       |                                              | /postgres_svr_2/
(10 rows)

--
-- TOASTed value test
--
--Testcase 31:
INSERT INTO tntbl4 VALUES(30, repeat('x', 25));
--Testcase 32:
SELECT c1, c3, char_length(c2) FROM tntbl4 ORDER BY c1, c2, c3, c4, c5;
 c1 | c3 | char_length 
----+----+-------------
 -1 | t  |            
  1 | t  |           2
  3 |    |            
  4 |    |           5
  5 | t  |            
  6 | f  |           4
 10 | t  |           4
 20 | f  |           4
 20 | f  |           8
 30 |    |          25
    |    |            
(11 rows)

--
-- INSERT with IN feature
--
--Testcase 33:
INSERT INTO tntbl4 IN ('/postgres_svr/') VALUES (12, '_test', true, 5.0, 5000);
--Testcase 34:
SELECT * FROM tntbl4 ORDER BY c1, c2, c3, c4, c5;
 c1 |            c2             | c3 | c4  |  c5   |                                                                                                                               c6                                                                                                                                |      c7       | c8  | c9  |         c10         |          c11           |    c12     |                 c13                 |                                   c14                                   |                 c15                  |   c16   |         c17          |    c18     |  c19  |                     c20                      |    __spd_url     
----+---------------------------+----+-----+-------+-----------------------------------------------------------------------------------------------------------------------------------------------------------------------------------------------------------------------------------------------------------------+---------------+-----+-----+---------------------+------------------------+------------+-------------------------------------+-------------------------------------------------------------------------+--------------------------------------+---------+----------------------+------------+-------+----------------------------------------------+------------------
 -1 |                           | t  |   4 |  4000 | value 2                                                                                                                                                                                                                                                         |               |     |     |                     |                        |            |                                     |                                                                         |                                      |         |                      |            |       |                                              | /postgres_svr_2/
  1 | 40                        | t  |   2 |  2000 | value 1                                                                                                                                                                                                                                                         |               |     |     |                     |                        |            |                                     |                                                                         |                                      |         |                      |            |       |                                              | /postgres_svr/
  3 |                           |    |     |       |                                                                                                                                                                                                                                                                 |               |     |     |                     |                        |            |                                     |                                                                         |                                      |         |                      |            |       |                                              | /postgres_svr/
  4 | ANC#$                     |    |     |       |                                                                                                                                                                                                                                                                 |               |     |     |                     |                        |            |                                     |                                                                         |                                      |         |                      |            |       |                                              | /postgres_svr_2/
  5 |                           | t  |  10 |  1000 | char array                                                                                                                                                                                                                                                      | char varying  | 100 | 127 | 2004-10-19 10:23:54 | 2004-10-19 08:23:54+00 | 0001-01-01 | { "customer": "John Does"}          | {"tags": ["tag1", "tag2"], "finished": true}                            | 2f404849-f62c-4234-b0c8-e230bd694045 | (1,-45) | \xa7a8a9aaabacadaeaf | 1111111111 | 10101 | @ 6 years 5 mons 4 days 3 hours 2 mins 1 sec | /postgres_svr/
  6 | test                      | f  |     |  2000 | test                                                                                                                                                                                                                                                            | test          | 200 |   0 |                     |                        |            |                                     |                                                                         |                                      |         |                      |            |       |                                              | /postgres_svr_2/
 10 | text                      | t  |  10 |  1000 | char array                                                                                                                                                                                                                                                      | varchar array |  -1 |  12 | 2004-10-19 10:23:54 | 2004-10-19 08:23:54+00 | 2001-01-01 | {"product": "test","quantity": 1}   | {"name": "paintings", "tags": ["Scene", "Portrait"], "finished": true}  | 2f404849-f62c-4234-b0c8-e230bd694045 | (1,-45) | \xa7a8a9aaabacadaeaf | 1111111111 | 10101 | @ 1 year 3 hours 20 mins                     | /postgres_svr/
 12 | _test                     | t  |   5 |  5000 |                                                                                                                                                                                                                                                                 |               |     |     |                     |                        |            |                                     |                                                                         |                                      |         |                      |            |       |                                              | /postgres_svr/
 20 | fun!                      | f  |   3 |  3000 | VALUES are fun!                                                                                                                                                                                                                                                 |               |     |     |                     |                        |            |                                     |                                                                         |                                      |         |                      |            |       |                                              | /postgres_svr/
 20 | texttext                  | f  | -10 | -1000 | char array                                                                                                                                                                                                                                                      | varchar array |   1 |   1 | 2005-10-19 10:23:54 | 2005-10-19 08:23:54+00 | 2001-01-01 | {"product": "sample","quantity": 1} | {"name": "paintings", "tags": ["Scene", "Portrait"], "finished": false} | 2f404849-f62c-4234-b0c8-e230bd694045 | (1,-45) | \xa7a8a9aaabacadaeaf | 1111111111 | 10101 | @ 1 year 3 hours 20 mins                     | /postgres_svr_2/
 30 | xxxxxxxxxxxxxxxxxxxxxxxxx |    |     |       |                                                                                                                                                                                                                                                                 |               |     |     |                     |                        |            |                                     |                                                                         |                                      |         |                      |            |       |                                              | /postgres_svr_2/
    |                           |    |     |       |                                                                                                                                                                                                                                                                 |               |     |     |                     |                        |            |                                     |                                                                         |                                      |         |                      |            |       |                                              | /postgres_svr_2/
(12 rows)

--Testcase 35:
INSERT INTO tntbl4 IN ('/postgres_svr/', '/postgres_svr_2/') VALUES (13, '_infea', true, 6.0, 6000);
--Testcase 36:
SELECT * FROM tntbl4 ORDER BY c1, c2, c3, c4, c5;
 c1 |            c2             | c3 | c4  |  c5   |                                                                                                                               c6                                                                                                                                |      c7       | c8  | c9  |         c10         |          c11           |    c12     |                 c13                 |                                   c14                                   |                 c15                  |   c16   |         c17          |    c18     |  c19  |                     c20                      |    __spd_url     
----+---------------------------+----+-----+-------+-----------------------------------------------------------------------------------------------------------------------------------------------------------------------------------------------------------------------------------------------------------------+---------------+-----+-----+---------------------+------------------------+------------+-------------------------------------+-------------------------------------------------------------------------+--------------------------------------+---------+----------------------+------------+-------+----------------------------------------------+------------------
 -1 |                           | t  |   4 |  4000 | value 2                                                                                                                                                                                                                                                         |               |     |     |                     |                        |            |                                     |                                                                         |                                      |         |                      |            |       |                                              | /postgres_svr_2/
  1 | 40                        | t  |   2 |  2000 | value 1                                                                                                                                                                                                                                                         |               |     |     |                     |                        |            |                                     |                                                                         |                                      |         |                      |            |       |                                              | /postgres_svr/
  3 |                           |    |     |       |                                                                                                                                                                                                                                                                 |               |     |     |                     |                        |            |                                     |                                                                         |                                      |         |                      |            |       |                                              | /postgres_svr/
  4 | ANC#$                     |    |     |       |                                                                                                                                                                                                                                                                 |               |     |     |                     |                        |            |                                     |                                                                         |                                      |         |                      |            |       |                                              | /postgres_svr_2/
  5 |                           | t  |  10 |  1000 | char array                                                                                                                                                                                                                                                      | char varying  | 100 | 127 | 2004-10-19 10:23:54 | 2004-10-19 08:23:54+00 | 0001-01-01 | { "customer": "John Does"}          | {"tags": ["tag1", "tag2"], "finished": true}                            | 2f404849-f62c-4234-b0c8-e230bd694045 | (1,-45) | \xa7a8a9aaabacadaeaf | 1111111111 | 10101 | @ 6 years 5 mons 4 days 3 hours 2 mins 1 sec | /postgres_svr/
  6 | test                      | f  |     |  2000 | test                                                                                                                                                                                                                                                            | test          | 200 |   0 |                     |                        |            |                                     |                                                                         |                                      |         |                      |            |       |                                              | /postgres_svr_2/
 10 | text                      | t  |  10 |  1000 | char array                                                                                                                                                                                                                                                      | varchar array |  -1 |  12 | 2004-10-19 10:23:54 | 2004-10-19 08:23:54+00 | 2001-01-01 | {"product": "test","quantity": 1}   | {"name": "paintings", "tags": ["Scene", "Portrait"], "finished": true}  | 2f404849-f62c-4234-b0c8-e230bd694045 | (1,-45) | \xa7a8a9aaabacadaeaf | 1111111111 | 10101 | @ 1 year 3 hours 20 mins                     | /postgres_svr/
 12 | _test                     | t  |   5 |  5000 |                                                                                                                                                                                                                                                                 |               |     |     |                     |                        |            |                                     |                                                                         |                                      |         |                      |            |       |                                              | /postgres_svr/
 13 | _infea                    | t  |   6 |  6000 |                                                                                                                                                                                                                                                                 |               |     |     |                     |                        |            |                                     |                                                                         |                                      |         |                      |            |       |                                              | /postgres_svr_2/
 20 | fun!                      | f  |   3 |  3000 | VALUES are fun!                                                                                                                                                                                                                                                 |               |     |     |                     |                        |            |                                     |                                                                         |                                      |         |                      |            |       |                                              | /postgres_svr/
 20 | texttext                  | f  | -10 | -1000 | char array                                                                                                                                                                                                                                                      | varchar array |   1 |   1 | 2005-10-19 10:23:54 | 2005-10-19 08:23:54+00 | 2001-01-01 | {"product": "sample","quantity": 1} | {"name": "paintings", "tags": ["Scene", "Portrait"], "finished": false} | 2f404849-f62c-4234-b0c8-e230bd694045 | (1,-45) | \xa7a8a9aaabacadaeaf | 1111111111 | 10101 | @ 1 year 3 hours 20 mins                     | /postgres_svr_2/
 30 | xxxxxxxxxxxxxxxxxxxxxxxxx |    |     |       |                                                                                                                                                                                                                                                                 |               |     |     |                     |                        |            |                                     |                                                                         |                                      |         |                      |            |       |                                              | /postgres_svr_2/
    |                           |    |     |       |                                                                                                                                                                                                                                                                 |               |     |     |                     |                        |            |                                     |                                                                         |                                      |         |                      |            |       |                                              | /postgres_svr_2/
(13 rows)

--
-- UPDATE
--
--Testcase 37:
SELECT c1, char_length(c2), c3, c4, c5, c6, c7, c8, c9, c10, c11, c12, c13, c14, c15, c16, c17, c18, c19, c20 FROM tntbl4 ORDER BY c1, c2, c3, c4, c5;
 c1 | char_length | c3 | c4  |  c5   |                                                                                                                               c6                                                                                                                                |      c7       | c8  | c9  |         c10         |          c11           |    c12     |                 c13                 |                                   c14                                   |                 c15                  |   c16   |         c17          |    c18     |  c19  |                     c20                      
----+-------------+----+-----+-------+-----------------------------------------------------------------------------------------------------------------------------------------------------------------------------------------------------------------------------------------------------------------+---------------+-----+-----+---------------------+------------------------+------------+-------------------------------------+-------------------------------------------------------------------------+--------------------------------------+---------+----------------------+------------+-------+----------------------------------------------
 -1 |             | t  |   4 |  4000 | value 2                                                                                                                                                                                                                                                         |               |     |     |                     |                        |            |                                     |                                                                         |                                      |         |                      |            |       | 
  1 |           2 | t  |   2 |  2000 | value 1                                                                                                                                                                                                                                                         |               |     |     |                     |                        |            |                                     |                                                                         |                                      |         |                      |            |       | 
  3 |             |    |     |       |                                                                                                                                                                                                                                                                 |               |     |     |                     |                        |            |                                     |                                                                         |                                      |         |                      |            |       | 
  4 |           5 |    |     |       |                                                                                                                                                                                                                                                                 |               |     |     |                     |                        |            |                                     |                                                                         |                                      |         |                      |            |       | 
  5 |             | t  |  10 |  1000 | char array                                                                                                                                                                                                                                                      | char varying  | 100 | 127 | 2004-10-19 10:23:54 | 2004-10-19 08:23:54+00 | 0001-01-01 | { "customer": "John Does"}          | {"tags": ["tag1", "tag2"], "finished": true}                            | 2f404849-f62c-4234-b0c8-e230bd694045 | (1,-45) | \xa7a8a9aaabacadaeaf | 1111111111 | 10101 | @ 6 years 5 mons 4 days 3 hours 2 mins 1 sec
  6 |           4 | f  |     |  2000 | test                                                                                                                                                                                                                                                            | test          | 200 |   0 |                     |                        |            |                                     |                                                                         |                                      |         |                      |            |       | 
 10 |           4 | t  |  10 |  1000 | char array                                                                                                                                                                                                                                                      | varchar array |  -1 |  12 | 2004-10-19 10:23:54 | 2004-10-19 08:23:54+00 | 2001-01-01 | {"product": "test","quantity": 1}   | {"name": "paintings", "tags": ["Scene", "Portrait"], "finished": true}  | 2f404849-f62c-4234-b0c8-e230bd694045 | (1,-45) | \xa7a8a9aaabacadaeaf | 1111111111 | 10101 | @ 1 year 3 hours 20 mins
 12 |           5 | t  |   5 |  5000 |                                                                                                                                                                                                                                                                 |               |     |     |                     |                        |            |                                     |                                                                         |                                      |         |                      |            |       | 
 13 |           6 | t  |   6 |  6000 |                                                                                                                                                                                                                                                                 |               |     |     |                     |                        |            |                                     |                                                                         |                                      |         |                      |            |       | 
 20 |           4 | f  |   3 |  3000 | VALUES are fun!                                                                                                                                                                                                                                                 |               |     |     |                     |                        |            |                                     |                                                                         |                                      |         |                      |            |       | 
 20 |           8 | f  | -10 | -1000 | char array                                                                                                                                                                                                                                                      | varchar array |   1 |   1 | 2005-10-19 10:23:54 | 2005-10-19 08:23:54+00 | 2001-01-01 | {"product": "sample","quantity": 1} | {"name": "paintings", "tags": ["Scene", "Portrait"], "finished": false} | 2f404849-f62c-4234-b0c8-e230bd694045 | (1,-45) | \xa7a8a9aaabacadaeaf | 1111111111 | 10101 | @ 1 year 3 hours 20 mins
 30 |          25 |    |     |       |                                                                                                                                                                                                                                                                 |               |     |     |                     |                        |            |                                     |                                                                         |                                      |         |                      |            |       | 
    |             |    |     |       |                                                                                                                                                                                                                                                                 |               |     |     |                     |                        |            |                                     |                                                                         |                                      |         |                      |            |       | 
(13 rows)

--Testcase 38:
UPDATE tntbl4 SET c3 = DEFAULT, c6 = DEFAULT;
--Testcase 39:
SELECT c1, char_length(c2), c3, c4, c5, c6, c7, c8, c9, c10, c11, c12, c13, c14, c15, c16, c17, c18, c19, c20 FROM tntbl4 ORDER BY c1, c2, c3, c4, c5;
 c1 | char_length | c3 | c4  |  c5   | c6 |      c7       | c8  | c9  |         c10         |          c11           |    c12     |                 c13                 |                                   c14                                   |                 c15                  |   c16   |         c17          |    c18     |  c19  |                     c20                      
----+-------------+----+-----+-------+----+---------------+-----+-----+---------------------+------------------------+------------+-------------------------------------+-------------------------------------------------------------------------+--------------------------------------+---------+----------------------+------------+-------+----------------------------------------------
 -1 |             |    |   4 |  4000 |    |               |     |     |                     |                        |            |                                     |                                                                         |                                      |         |                      |            |       | 
  1 |           2 |    |   2 |  2000 |    |               |     |     |                     |                        |            |                                     |                                                                         |                                      |         |                      |            |       | 
  3 |             |    |     |       |    |               |     |     |                     |                        |            |                                     |                                                                         |                                      |         |                      |            |       | 
  4 |           5 |    |     |       |    |               |     |     |                     |                        |            |                                     |                                                                         |                                      |         |                      |            |       | 
  5 |             |    |  10 |  1000 |    | char varying  | 100 | 127 | 2004-10-19 10:23:54 | 2004-10-19 08:23:54+00 | 0001-01-01 | { "customer": "John Does"}          | {"tags": ["tag1", "tag2"], "finished": true}                            | 2f404849-f62c-4234-b0c8-e230bd694045 | (1,-45) | \xa7a8a9aaabacadaeaf | 1111111111 | 10101 | @ 6 years 5 mons 4 days 3 hours 2 mins 1 sec
  6 |           4 |    |     |  2000 |    | test          | 200 |   0 |                     |                        |            |                                     |                                                                         |                                      |         |                      |            |       | 
 10 |           4 |    |  10 |  1000 |    | varchar array |  -1 |  12 | 2004-10-19 10:23:54 | 2004-10-19 08:23:54+00 | 2001-01-01 | {"product": "test","quantity": 1}   | {"name": "paintings", "tags": ["Scene", "Portrait"], "finished": true}  | 2f404849-f62c-4234-b0c8-e230bd694045 | (1,-45) | \xa7a8a9aaabacadaeaf | 1111111111 | 10101 | @ 1 year 3 hours 20 mins
 12 |           5 |    |   5 |  5000 |    |               |     |     |                     |                        |            |                                     |                                                                         |                                      |         |                      |            |       | 
 13 |           6 |    |   6 |  6000 |    |               |     |     |                     |                        |            |                                     |                                                                         |                                      |         |                      |            |       | 
 20 |           4 |    |   3 |  3000 |    |               |     |     |                     |                        |            |                                     |                                                                         |                                      |         |                      |            |       | 
 20 |           8 |    | -10 | -1000 |    | varchar array |   1 |   1 | 2005-10-19 10:23:54 | 2005-10-19 08:23:54+00 | 2001-01-01 | {"product": "sample","quantity": 1} | {"name": "paintings", "tags": ["Scene", "Portrait"], "finished": false} | 2f404849-f62c-4234-b0c8-e230bd694045 | (1,-45) | \xa7a8a9aaabacadaeaf | 1111111111 | 10101 | @ 1 year 3 hours 20 mins
 30 |          25 |    |     |       |    |               |     |     |                     |                        |            |                                     |                                                                         |                                      |         |                      |            |       | 
    |             |    |     |       |    |               |     |     |                     |                        |            |                                     |                                                                         |                                      |         |                      |            |       | 
(13 rows)

-- aliases for the UPDATE target table
--Testcase 40:
UPDATE tntbl4 AS t SET c5 = 10000 WHERE t.c1 = 20;
--Testcase 41:
SELECT c1, char_length(c2), c3, c4, c5, c6, c7, c8, c9, c10, c11, c12, c13, c14, c15, c16, c17, c18, c19, c20 FROM tntbl4 ORDER BY c1, c2, c3, c4, c5;
 c1 | char_length | c3 | c4  |  c5   | c6 |      c7       | c8  | c9  |         c10         |          c11           |    c12     |                 c13                 |                                   c14                                   |                 c15                  |   c16   |         c17          |    c18     |  c19  |                     c20                      
----+-------------+----+-----+-------+----+---------------+-----+-----+---------------------+------------------------+------------+-------------------------------------+-------------------------------------------------------------------------+--------------------------------------+---------+----------------------+------------+-------+----------------------------------------------
 -1 |             |    |   4 |  4000 |    |               |     |     |                     |                        |            |                                     |                                                                         |                                      |         |                      |            |       | 
  1 |           2 |    |   2 |  2000 |    |               |     |     |                     |                        |            |                                     |                                                                         |                                      |         |                      |            |       | 
  3 |             |    |     |       |    |               |     |     |                     |                        |            |                                     |                                                                         |                                      |         |                      |            |       | 
  4 |           5 |    |     |       |    |               |     |     |                     |                        |            |                                     |                                                                         |                                      |         |                      |            |       | 
  5 |             |    |  10 |  1000 |    | char varying  | 100 | 127 | 2004-10-19 10:23:54 | 2004-10-19 08:23:54+00 | 0001-01-01 | { "customer": "John Does"}          | {"tags": ["tag1", "tag2"], "finished": true}                            | 2f404849-f62c-4234-b0c8-e230bd694045 | (1,-45) | \xa7a8a9aaabacadaeaf | 1111111111 | 10101 | @ 6 years 5 mons 4 days 3 hours 2 mins 1 sec
  6 |           4 |    |     |  2000 |    | test          | 200 |   0 |                     |                        |            |                                     |                                                                         |                                      |         |                      |            |       | 
 10 |           4 |    |  10 |  1000 |    | varchar array |  -1 |  12 | 2004-10-19 10:23:54 | 2004-10-19 08:23:54+00 | 2001-01-01 | {"product": "test","quantity": 1}   | {"name": "paintings", "tags": ["Scene", "Portrait"], "finished": true}  | 2f404849-f62c-4234-b0c8-e230bd694045 | (1,-45) | \xa7a8a9aaabacadaeaf | 1111111111 | 10101 | @ 1 year 3 hours 20 mins
 12 |           5 |    |   5 |  5000 |    |               |     |     |                     |                        |            |                                     |                                                                         |                                      |         |                      |            |       | 
 13 |           6 |    |   6 |  6000 |    |               |     |     |                     |                        |            |                                     |                                                                         |                                      |         |                      |            |       | 
 20 |           4 |    |   3 | 10000 |    |               |     |     |                     |                        |            |                                     |                                                                         |                                      |         |                      |            |       | 
 20 |           8 |    | -10 | 10000 |    | varchar array |   1 |   1 | 2005-10-19 10:23:54 | 2005-10-19 08:23:54+00 | 2001-01-01 | {"product": "sample","quantity": 1} | {"name": "paintings", "tags": ["Scene", "Portrait"], "finished": false} | 2f404849-f62c-4234-b0c8-e230bd694045 | (1,-45) | \xa7a8a9aaabacadaeaf | 1111111111 | 10101 | @ 1 year 3 hours 20 mins
 30 |          25 |    |     |       |    |               |     |     |                     |                        |            |                                     |                                                                         |                                      |         |                      |            |       | 
    |             |    |     |       |    |               |     |     |                     |                        |            |                                     |                                                                         |                                      |         |                      |            |       | 
(13 rows)

--Testcase 42:
UPDATE tntbl4 t SET c5 = t.c5 + 10 WHERE t.c1 = 20;
--Testcase 43:
SELECT c1, char_length(c2), c3, c4, c5, c6, c7, c8, c9, c10, c11, c12, c13, c14, c15, c16, c17, c18, c19, c20 FROM tntbl4 ORDER BY c1, c2, c3, c4, c5;
 c1 | char_length | c3 | c4  |  c5   | c6 |      c7       | c8  | c9  |         c10         |          c11           |    c12     |                 c13                 |                                   c14                                   |                 c15                  |   c16   |         c17          |    c18     |  c19  |                     c20                      
----+-------------+----+-----+-------+----+---------------+-----+-----+---------------------+------------------------+------------+-------------------------------------+-------------------------------------------------------------------------+--------------------------------------+---------+----------------------+------------+-------+----------------------------------------------
 -1 |             |    |   4 |  4000 |    |               |     |     |                     |                        |            |                                     |                                                                         |                                      |         |                      |            |       | 
  1 |           2 |    |   2 |  2000 |    |               |     |     |                     |                        |            |                                     |                                                                         |                                      |         |                      |            |       | 
  3 |             |    |     |       |    |               |     |     |                     |                        |            |                                     |                                                                         |                                      |         |                      |            |       | 
  4 |           5 |    |     |       |    |               |     |     |                     |                        |            |                                     |                                                                         |                                      |         |                      |            |       | 
  5 |             |    |  10 |  1000 |    | char varying  | 100 | 127 | 2004-10-19 10:23:54 | 2004-10-19 08:23:54+00 | 0001-01-01 | { "customer": "John Does"}          | {"tags": ["tag1", "tag2"], "finished": true}                            | 2f404849-f62c-4234-b0c8-e230bd694045 | (1,-45) | \xa7a8a9aaabacadaeaf | 1111111111 | 10101 | @ 6 years 5 mons 4 days 3 hours 2 mins 1 sec
  6 |           4 |    |     |  2000 |    | test          | 200 |   0 |                     |                        |            |                                     |                                                                         |                                      |         |                      |            |       | 
 10 |           4 |    |  10 |  1000 |    | varchar array |  -1 |  12 | 2004-10-19 10:23:54 | 2004-10-19 08:23:54+00 | 2001-01-01 | {"product": "test","quantity": 1}   | {"name": "paintings", "tags": ["Scene", "Portrait"], "finished": true}  | 2f404849-f62c-4234-b0c8-e230bd694045 | (1,-45) | \xa7a8a9aaabacadaeaf | 1111111111 | 10101 | @ 1 year 3 hours 20 mins
 12 |           5 |    |   5 |  5000 |    |               |     |     |                     |                        |            |                                     |                                                                         |                                      |         |                      |            |       | 
 13 |           6 |    |   6 |  6000 |    |               |     |     |                     |                        |            |                                     |                                                                         |                                      |         |                      |            |       | 
 20 |           4 |    |   3 | 10010 |    |               |     |     |                     |                        |            |                                     |                                                                         |                                      |         |                      |            |       | 
 20 |           8 |    | -10 | 10010 |    | varchar array |   1 |   1 | 2005-10-19 10:23:54 | 2005-10-19 08:23:54+00 | 2001-01-01 | {"product": "sample","quantity": 1} | {"name": "paintings", "tags": ["Scene", "Portrait"], "finished": false} | 2f404849-f62c-4234-b0c8-e230bd694045 | (1,-45) | \xa7a8a9aaabacadaeaf | 1111111111 | 10101 | @ 1 year 3 hours 20 mins
 30 |          25 |    |     |       |    |               |     |     |                     |                        |            |                                     |                                                                         |                                      |         |                      |            |       | 
    |             |    |     |       |    |               |     |     |                     |                        |            |                                     |                                                                         |                                      |         |                      |            |       | 
(13 rows)

--
-- Test VALUES in FROM
--
--Testcase 44:
UPDATE tntbl4 SET c1 = v.i FROM (VALUES(100, 2000)) AS v(i, j)
  WHERE tntbl4.c5 = v.j;
--Testcase 45:
SELECT c1, char_length(c2), c3, c4, c5, c6, c7, c8, c9, c10, c11, c12, c13, c14, c15, c16, c17, c18, c19, c20 FROM tntbl4 ORDER BY c1, c2, c3, c4, c5;
 c1  | char_length | c3 | c4  |  c5   | c6 |      c7       | c8  | c9  |         c10         |          c11           |    c12     |                 c13                 |                                   c14                                   |                 c15                  |   c16   |         c17          |    c18     |  c19  |                     c20                      
-----+-------------+----+-----+-------+----+---------------+-----+-----+---------------------+------------------------+------------+-------------------------------------+-------------------------------------------------------------------------+--------------------------------------+---------+----------------------+------------+-------+----------------------------------------------
  -1 |             |    |   4 |  4000 |    |               |     |     |                     |                        |            |                                     |                                                                         |                                      |         |                      |            |       | 
   3 |             |    |     |       |    |               |     |     |                     |                        |            |                                     |                                                                         |                                      |         |                      |            |       | 
   4 |           5 |    |     |       |    |               |     |     |                     |                        |            |                                     |                                                                         |                                      |         |                      |            |       | 
   5 |             |    |  10 |  1000 |    | char varying  | 100 | 127 | 2004-10-19 10:23:54 | 2004-10-19 08:23:54+00 | 0001-01-01 | { "customer": "John Does"}          | {"tags": ["tag1", "tag2"], "finished": true}                            | 2f404849-f62c-4234-b0c8-e230bd694045 | (1,-45) | \xa7a8a9aaabacadaeaf | 1111111111 | 10101 | @ 6 years 5 mons 4 days 3 hours 2 mins 1 sec
  10 |           4 |    |  10 |  1000 |    | varchar array |  -1 |  12 | 2004-10-19 10:23:54 | 2004-10-19 08:23:54+00 | 2001-01-01 | {"product": "test","quantity": 1}   | {"name": "paintings", "tags": ["Scene", "Portrait"], "finished": true}  | 2f404849-f62c-4234-b0c8-e230bd694045 | (1,-45) | \xa7a8a9aaabacadaeaf | 1111111111 | 10101 | @ 1 year 3 hours 20 mins
  12 |           5 |    |   5 |  5000 |    |               |     |     |                     |                        |            |                                     |                                                                         |                                      |         |                      |            |       | 
  13 |           6 |    |   6 |  6000 |    |               |     |     |                     |                        |            |                                     |                                                                         |                                      |         |                      |            |       | 
  20 |           4 |    |   3 | 10010 |    |               |     |     |                     |                        |            |                                     |                                                                         |                                      |         |                      |            |       | 
  20 |           8 |    | -10 | 10010 |    | varchar array |   1 |   1 | 2005-10-19 10:23:54 | 2005-10-19 08:23:54+00 | 2001-01-01 | {"product": "sample","quantity": 1} | {"name": "paintings", "tags": ["Scene", "Portrait"], "finished": false} | 2f404849-f62c-4234-b0c8-e230bd694045 | (1,-45) | \xa7a8a9aaabacadaeaf | 1111111111 | 10101 | @ 1 year 3 hours 20 mins
  30 |          25 |    |     |       |    |               |     |     |                     |                        |            |                                     |                                                                         |                                      |         |                      |            |       | 
 100 |           2 |    |   2 |  2000 |    |               |     |     |                     |                        |            |                                     |                                                                         |                                      |         |                      |            |       | 
 100 |           4 |    |     |  2000 |    | test          | 200 |   0 |                     |                        |            |                                     |                                                                         |                                      |         |                      |            |       | 
     |             |    |     |       |    |               |     |     |                     |                        |            |                                     |                                                                         |                                      |         |                      |            |       | 
(13 rows)

-- fail, wrong data type:
--Testcase 46:
UPDATE tntbl4 SET c1 = v.* FROM (VALUES(100, 2000)) AS v(i, j)
  WHERE tntbl4.c5 = v.j;
ERROR:  column "c1" is of type integer but expression is of type record
LINE 1: UPDATE tntbl4 SET c1 = v.* FROM (VALUES(100, 2000)) AS v(i, ...
                               ^
HINT:  You will need to rewrite or cast the expression.
--
-- Test multiple-set-clause syntax
--
--Testcase 47:
INSERT INTO tntbl4 (SELECT c1 + 10, c2 || 'next', c3 != true FROM tntbl4 ORDER BY 1, 2, 3);
--Testcase 48:
SELECT c1, char_length(c2), c3, c4, c5, c6, c7, c8, c9, c10, c11, c12, c13, c14, c15, c16, c17, c18, c19, c20 FROM tntbl4 ORDER BY c1, c2, c3, c4, c5;
 c1  | char_length | c3 | c4  |  c5   | c6 |      c7       | c8  | c9  |         c10         |          c11           |    c12     |                 c13                 |                                   c14                                   |                 c15                  |   c16   |         c17          |    c18     |  c19  |                     c20                      
-----+-------------+----+-----+-------+----+---------------+-----+-----+---------------------+------------------------+------------+-------------------------------------+-------------------------------------------------------------------------+--------------------------------------+---------+----------------------+------------+-------+----------------------------------------------
  -1 |             |    |   4 |  4000 |    |               |     |     |                     |                        |            |                                     |                                                                         |                                      |         |                      |            |       | 
   3 |             |    |     |       |    |               |     |     |                     |                        |            |                                     |                                                                         |                                      |         |                      |            |       | 
   4 |           5 |    |     |       |    |               |     |     |                     |                        |            |                                     |                                                                         |                                      |         |                      |            |       | 
   5 |             |    |  10 |  1000 |    | char varying  | 100 | 127 | 2004-10-19 10:23:54 | 2004-10-19 08:23:54+00 | 0001-01-01 | { "customer": "John Does"}          | {"tags": ["tag1", "tag2"], "finished": true}                            | 2f404849-f62c-4234-b0c8-e230bd694045 | (1,-45) | \xa7a8a9aaabacadaeaf | 1111111111 | 10101 | @ 6 years 5 mons 4 days 3 hours 2 mins 1 sec
   9 |             |    |     |       |    |               |     |     |                     |                        |            |                                     |                                                                         |                                      |         |                      |            |       | 
  10 |           4 |    |  10 |  1000 |    | varchar array |  -1 |  12 | 2004-10-19 10:23:54 | 2004-10-19 08:23:54+00 | 2001-01-01 | {"product": "test","quantity": 1}   | {"name": "paintings", "tags": ["Scene", "Portrait"], "finished": true}  | 2f404849-f62c-4234-b0c8-e230bd694045 | (1,-45) | \xa7a8a9aaabacadaeaf | 1111111111 | 10101 | @ 1 year 3 hours 20 mins
  12 |           5 |    |   5 |  5000 |    |               |     |     |                     |                        |            |                                     |                                                                         |                                      |         |                      |            |       | 
  13 |           6 |    |   6 |  6000 |    |               |     |     |                     |                        |            |                                     |                                                                         |                                      |         |                      |            |       | 
  13 |             |    |     |       |    |               |     |     |                     |                        |            |                                     |                                                                         |                                      |         |                      |            |       | 
  14 |           9 |    |     |       |    |               |     |     |                     |                        |            |                                     |                                                                         |                                      |         |                      |            |       | 
  15 |             |    |     |       |    |               |     |     |                     |                        |            |                                     |                                                                         |                                      |         |                      |            |       | 
  20 |           4 |    |   3 | 10010 |    |               |     |     |                     |                        |            |                                     |                                                                         |                                      |         |                      |            |       | 
  20 |           8 |    |     |       |    |               |     |     |                     |                        |            |                                     |                                                                         |                                      |         |                      |            |       | 
  20 |           8 |    | -10 | 10010 |    | varchar array |   1 |   1 | 2005-10-19 10:23:54 | 2005-10-19 08:23:54+00 | 2001-01-01 | {"product": "sample","quantity": 1} | {"name": "paintings", "tags": ["Scene", "Portrait"], "finished": false} | 2f404849-f62c-4234-b0c8-e230bd694045 | (1,-45) | \xa7a8a9aaabacadaeaf | 1111111111 | 10101 | @ 1 year 3 hours 20 mins
  22 |           9 |    |     |       |    |               |     |     |                     |                        |            |                                     |                                                                         |                                      |         |                      |            |       | 
  23 |          10 |    |     |       |    |               |     |     |                     |                        |            |                                     |                                                                         |                                      |         |                      |            |       | 
  30 |           8 |    |     |       |    |               |     |     |                     |                        |            |                                     |                                                                         |                                      |         |                      |            |       | 
  30 |          12 |    |     |       |    |               |     |     |                     |                        |            |                                     |                                                                         |                                      |         |                      |            |       | 
  30 |          25 |    |     |       |    |               |     |     |                     |                        |            |                                     |                                                                         |                                      |         |                      |            |       | 
  40 |          29 |    |     |       |    |               |     |     |                     |                        |            |                                     |                                                                         |                                      |         |                      |            |       | 
 100 |           2 |    |   2 |  2000 |    |               |     |     |                     |                        |            |                                     |                                                                         |                                      |         |                      |            |       | 
 100 |           4 |    |     |  2000 |    | test          | 200 |   0 |                     |                        |            |                                     |                                                                         |                                      |         |                      |            |       | 
 110 |           6 |    |     |       |    |               |     |     |                     |                        |            |                                     |                                                                         |                                      |         |                      |            |       | 
 110 |           8 |    |     |       |    |               |     |     |                     |                        |            |                                     |                                                                         |                                      |         |                      |            |       | 
     |             |    |     |       |    |               |     |     |                     |                        |            |                                     |                                                                         |                                      |         |                      |            |       | 
     |             |    |     |       |    |               |     |     |                     |                        |            |                                     |                                                                         |                                      |         |                      |            |       | 
(26 rows)

--Testcase 49:
UPDATE tntbl4 SET (c2 , c1, c4) = ('bugle', c1 + 10, DEFAULT) WHERE c2 = 'fun!';
--Testcase 50:
SELECT c1, char_length(c2), c3, c4, c5, c6, c7, c8, c9, c10, c11, c12, c13, c14, c15, c16, c17, c18, c19, c20 FROM tntbl4 ORDER BY c1, c2, c3, c4, c5;
 c1  | char_length | c3 | c4  |  c5   | c6 |      c7       | c8  | c9  |         c10         |          c11           |    c12     |                 c13                 |                                   c14                                   |                 c15                  |   c16   |         c17          |    c18     |  c19  |                     c20                      
-----+-------------+----+-----+-------+----+---------------+-----+-----+---------------------+------------------------+------------+-------------------------------------+-------------------------------------------------------------------------+--------------------------------------+---------+----------------------+------------+-------+----------------------------------------------
  -1 |             |    |   4 |  4000 |    |               |     |     |                     |                        |            |                                     |                                                                         |                                      |         |                      |            |       | 
   3 |             |    |     |       |    |               |     |     |                     |                        |            |                                     |                                                                         |                                      |         |                      |            |       | 
   4 |           5 |    |     |       |    |               |     |     |                     |                        |            |                                     |                                                                         |                                      |         |                      |            |       | 
   5 |             |    |  10 |  1000 |    | char varying  | 100 | 127 | 2004-10-19 10:23:54 | 2004-10-19 08:23:54+00 | 0001-01-01 | { "customer": "John Does"}          | {"tags": ["tag1", "tag2"], "finished": true}                            | 2f404849-f62c-4234-b0c8-e230bd694045 | (1,-45) | \xa7a8a9aaabacadaeaf | 1111111111 | 10101 | @ 6 years 5 mons 4 days 3 hours 2 mins 1 sec
   9 |             |    |     |       |    |               |     |     |                     |                        |            |                                     |                                                                         |                                      |         |                      |            |       | 
  10 |           4 |    |  10 |  1000 |    | varchar array |  -1 |  12 | 2004-10-19 10:23:54 | 2004-10-19 08:23:54+00 | 2001-01-01 | {"product": "test","quantity": 1}   | {"name": "paintings", "tags": ["Scene", "Portrait"], "finished": true}  | 2f404849-f62c-4234-b0c8-e230bd694045 | (1,-45) | \xa7a8a9aaabacadaeaf | 1111111111 | 10101 | @ 1 year 3 hours 20 mins
  12 |           5 |    |   5 |  5000 |    |               |     |     |                     |                        |            |                                     |                                                                         |                                      |         |                      |            |       | 
  13 |           6 |    |   6 |  6000 |    |               |     |     |                     |                        |            |                                     |                                                                         |                                      |         |                      |            |       | 
  13 |             |    |     |       |    |               |     |     |                     |                        |            |                                     |                                                                         |                                      |         |                      |            |       | 
  14 |           9 |    |     |       |    |               |     |     |                     |                        |            |                                     |                                                                         |                                      |         |                      |            |       | 
  15 |             |    |     |       |    |               |     |     |                     |                        |            |                                     |                                                                         |                                      |         |                      |            |       | 
  20 |           8 |    |     |       |    |               |     |     |                     |                        |            |                                     |                                                                         |                                      |         |                      |            |       | 
  20 |           8 |    | -10 | 10010 |    | varchar array |   1 |   1 | 2005-10-19 10:23:54 | 2005-10-19 08:23:54+00 | 2001-01-01 | {"product": "sample","quantity": 1} | {"name": "paintings", "tags": ["Scene", "Portrait"], "finished": false} | 2f404849-f62c-4234-b0c8-e230bd694045 | (1,-45) | \xa7a8a9aaabacadaeaf | 1111111111 | 10101 | @ 1 year 3 hours 20 mins
  22 |           9 |    |     |       |    |               |     |     |                     |                        |            |                                     |                                                                         |                                      |         |                      |            |       | 
  23 |          10 |    |     |       |    |               |     |     |                     |                        |            |                                     |                                                                         |                                      |         |                      |            |       | 
  30 |           5 |    |     | 10010 |    |               |     |     |                     |                        |            |                                     |                                                                         |                                      |         |                      |            |       | 
  30 |           8 |    |     |       |    |               |     |     |                     |                        |            |                                     |                                                                         |                                      |         |                      |            |       | 
  30 |          12 |    |     |       |    |               |     |     |                     |                        |            |                                     |                                                                         |                                      |         |                      |            |       | 
  30 |          25 |    |     |       |    |               |     |     |                     |                        |            |                                     |                                                                         |                                      |         |                      |            |       | 
  40 |          29 |    |     |       |    |               |     |     |                     |                        |            |                                     |                                                                         |                                      |         |                      |            |       | 
 100 |           2 |    |   2 |  2000 |    |               |     |     |                     |                        |            |                                     |                                                                         |                                      |         |                      |            |       | 
 100 |           4 |    |     |  2000 |    | test          | 200 |   0 |                     |                        |            |                                     |                                                                         |                                      |         |                      |            |       | 
 110 |           6 |    |     |       |    |               |     |     |                     |                        |            |                                     |                                                                         |                                      |         |                      |            |       | 
 110 |           8 |    |     |       |    |               |     |     |                     |                        |            |                                     |                                                                         |                                      |         |                      |            |       | 
     |             |    |     |       |    |               |     |     |                     |                        |            |                                     |                                                                         |                                      |         |                      |            |       | 
     |             |    |     |       |    |               |     |     |                     |                        |            |                                     |                                                                         |                                      |         |                      |            |       | 
(26 rows)

--Testcase 51:
UPDATE tntbl4 SET (c2, c5) = ('car', c1 + c5), c1 = c1 + 10 WHERE c1 = 30;
--Testcase 52:
SELECT c1, char_length(c2), c3, c4, c5, c6, c7, c8, c9, c10, c11, c12, c13, c14, c15, c16, c17, c18, c19, c20 FROM tntbl4 ORDER BY c1, c2, c3, c4, c5;
 c1  | char_length | c3 | c4  |  c5   | c6 |      c7       | c8  | c9  |         c10         |          c11           |    c12     |                 c13                 |                                   c14                                   |                 c15                  |   c16   |         c17          |    c18     |  c19  |                     c20                      
-----+-------------+----+-----+-------+----+---------------+-----+-----+---------------------+------------------------+------------+-------------------------------------+-------------------------------------------------------------------------+--------------------------------------+---------+----------------------+------------+-------+----------------------------------------------
  -1 |             |    |   4 |  4000 |    |               |     |     |                     |                        |            |                                     |                                                                         |                                      |         |                      |            |       | 
   3 |             |    |     |       |    |               |     |     |                     |                        |            |                                     |                                                                         |                                      |         |                      |            |       | 
   4 |           5 |    |     |       |    |               |     |     |                     |                        |            |                                     |                                                                         |                                      |         |                      |            |       | 
   5 |             |    |  10 |  1000 |    | char varying  | 100 | 127 | 2004-10-19 10:23:54 | 2004-10-19 08:23:54+00 | 0001-01-01 | { "customer": "John Does"}          | {"tags": ["tag1", "tag2"], "finished": true}                            | 2f404849-f62c-4234-b0c8-e230bd694045 | (1,-45) | \xa7a8a9aaabacadaeaf | 1111111111 | 10101 | @ 6 years 5 mons 4 days 3 hours 2 mins 1 sec
   9 |             |    |     |       |    |               |     |     |                     |                        |            |                                     |                                                                         |                                      |         |                      |            |       | 
  10 |           4 |    |  10 |  1000 |    | varchar array |  -1 |  12 | 2004-10-19 10:23:54 | 2004-10-19 08:23:54+00 | 2001-01-01 | {"product": "test","quantity": 1}   | {"name": "paintings", "tags": ["Scene", "Portrait"], "finished": true}  | 2f404849-f62c-4234-b0c8-e230bd694045 | (1,-45) | \xa7a8a9aaabacadaeaf | 1111111111 | 10101 | @ 1 year 3 hours 20 mins
  12 |           5 |    |   5 |  5000 |    |               |     |     |                     |                        |            |                                     |                                                                         |                                      |         |                      |            |       | 
  13 |           6 |    |   6 |  6000 |    |               |     |     |                     |                        |            |                                     |                                                                         |                                      |         |                      |            |       | 
  13 |             |    |     |       |    |               |     |     |                     |                        |            |                                     |                                                                         |                                      |         |                      |            |       | 
  14 |           9 |    |     |       |    |               |     |     |                     |                        |            |                                     |                                                                         |                                      |         |                      |            |       | 
  15 |             |    |     |       |    |               |     |     |                     |                        |            |                                     |                                                                         |                                      |         |                      |            |       | 
  20 |           8 |    |     |       |    |               |     |     |                     |                        |            |                                     |                                                                         |                                      |         |                      |            |       | 
  20 |           8 |    | -10 | 10010 |    | varchar array |   1 |   1 | 2005-10-19 10:23:54 | 2005-10-19 08:23:54+00 | 2001-01-01 | {"product": "sample","quantity": 1} | {"name": "paintings", "tags": ["Scene", "Portrait"], "finished": false} | 2f404849-f62c-4234-b0c8-e230bd694045 | (1,-45) | \xa7a8a9aaabacadaeaf | 1111111111 | 10101 | @ 1 year 3 hours 20 mins
  22 |           9 |    |     |       |    |               |     |     |                     |                        |            |                                     |                                                                         |                                      |         |                      |            |       | 
  23 |          10 |    |     |       |    |               |     |     |                     |                        |            |                                     |                                                                         |                                      |         |                      |            |       | 
  40 |           3 |    |     | 10040 |    |               |     |     |                     |                        |            |                                     |                                                                         |                                      |         |                      |            |       | 
  40 |           3 |    |     |       |    |               |     |     |                     |                        |            |                                     |                                                                         |                                      |         |                      |            |       | 
  40 |           3 |    |     |       |    |               |     |     |                     |                        |            |                                     |                                                                         |                                      |         |                      |            |       | 
  40 |           3 |    |     |       |    |               |     |     |                     |                        |            |                                     |                                                                         |                                      |         |                      |            |       | 
  40 |          29 |    |     |       |    |               |     |     |                     |                        |            |                                     |                                                                         |                                      |         |                      |            |       | 
 100 |           2 |    |   2 |  2000 |    |               |     |     |                     |                        |            |                                     |                                                                         |                                      |         |                      |            |       | 
 100 |           4 |    |     |  2000 |    | test          | 200 |   0 |                     |                        |            |                                     |                                                                         |                                      |         |                      |            |       | 
 110 |           6 |    |     |       |    |               |     |     |                     |                        |            |                                     |                                                                         |                                      |         |                      |            |       | 
 110 |           8 |    |     |       |    |               |     |     |                     |                        |            |                                     |                                                                         |                                      |         |                      |            |       | 
     |             |    |     |       |    |               |     |     |                     |                        |            |                                     |                                                                         |                                      |         |                      |            |       | 
     |             |    |     |       |    |               |     |     |                     |                        |            |                                     |                                                                         |                                      |         |                      |            |       | 
(26 rows)

-- fail, multi assignment to same column:
--Testcase 53:
UPDATE tntbl4 SET (c6, c8) = ('car', c4 + c8), c8 = c4 + 1.0 WHERE c1 = 40;
ERROR:  multiple assignments to same column "c8"
-- uncorrelated sub-SELECT:
--Testcase 54:
UPDATE tntbl4
  SET (c9, c1) = (SELECT c1, c9 FROM tntbl4 where c1 = 40 and c2 = 'car')
  WHERE c5 = 1000 AND c4 = 2.0;
--Testcase 55:
SELECT c1, char_length(c2), c3, c4, c5, c6, c7, c8, c9, c10, c11, c12, c13, c14, c15, c16, c17, c18, c19, c20 FROM tntbl4 ORDER BY c1, c2, c3, c4, c5;
 c1  | char_length | c3 | c4  |  c5   | c6 |      c7       | c8  | c9  |         c10         |          c11           |    c12     |                 c13                 |                                   c14                                   |                 c15                  |   c16   |         c17          |    c18     |  c19  |                     c20                      
-----+-------------+----+-----+-------+----+---------------+-----+-----+---------------------+------------------------+------------+-------------------------------------+-------------------------------------------------------------------------+--------------------------------------+---------+----------------------+------------+-------+----------------------------------------------
  -1 |             |    |   4 |  4000 |    |               |     |     |                     |                        |            |                                     |                                                                         |                                      |         |                      |            |       | 
   3 |             |    |     |       |    |               |     |     |                     |                        |            |                                     |                                                                         |                                      |         |                      |            |       | 
   4 |           5 |    |     |       |    |               |     |     |                     |                        |            |                                     |                                                                         |                                      |         |                      |            |       | 
   5 |             |    |  10 |  1000 |    | char varying  | 100 | 127 | 2004-10-19 10:23:54 | 2004-10-19 08:23:54+00 | 0001-01-01 | { "customer": "John Does"}          | {"tags": ["tag1", "tag2"], "finished": true}                            | 2f404849-f62c-4234-b0c8-e230bd694045 | (1,-45) | \xa7a8a9aaabacadaeaf | 1111111111 | 10101 | @ 6 years 5 mons 4 days 3 hours 2 mins 1 sec
   9 |             |    |     |       |    |               |     |     |                     |                        |            |                                     |                                                                         |                                      |         |                      |            |       | 
  10 |           4 |    |  10 |  1000 |    | varchar array |  -1 |  12 | 2004-10-19 10:23:54 | 2004-10-19 08:23:54+00 | 2001-01-01 | {"product": "test","quantity": 1}   | {"name": "paintings", "tags": ["Scene", "Portrait"], "finished": true}  | 2f404849-f62c-4234-b0c8-e230bd694045 | (1,-45) | \xa7a8a9aaabacadaeaf | 1111111111 | 10101 | @ 1 year 3 hours 20 mins
  12 |           5 |    |   5 |  5000 |    |               |     |     |                     |                        |            |                                     |                                                                         |                                      |         |                      |            |       | 
  13 |           6 |    |   6 |  6000 |    |               |     |     |                     |                        |            |                                     |                                                                         |                                      |         |                      |            |       | 
  13 |             |    |     |       |    |               |     |     |                     |                        |            |                                     |                                                                         |                                      |         |                      |            |       | 
  14 |           9 |    |     |       |    |               |     |     |                     |                        |            |                                     |                                                                         |                                      |         |                      |            |       | 
  15 |             |    |     |       |    |               |     |     |                     |                        |            |                                     |                                                                         |                                      |         |                      |            |       | 
  20 |           8 |    |     |       |    |               |     |     |                     |                        |            |                                     |                                                                         |                                      |         |                      |            |       | 
  20 |           8 |    | -10 | 10010 |    | varchar array |   1 |   1 | 2005-10-19 10:23:54 | 2005-10-19 08:23:54+00 | 2001-01-01 | {"product": "sample","quantity": 1} | {"name": "paintings", "tags": ["Scene", "Portrait"], "finished": false} | 2f404849-f62c-4234-b0c8-e230bd694045 | (1,-45) | \xa7a8a9aaabacadaeaf | 1111111111 | 10101 | @ 1 year 3 hours 20 mins
  22 |           9 |    |     |       |    |               |     |     |                     |                        |            |                                     |                                                                         |                                      |         |                      |            |       | 
  23 |          10 |    |     |       |    |               |     |     |                     |                        |            |                                     |                                                                         |                                      |         |                      |            |       | 
  40 |           3 |    |     | 10040 |    |               |     |     |                     |                        |            |                                     |                                                                         |                                      |         |                      |            |       | 
  40 |           3 |    |     |       |    |               |     |     |                     |                        |            |                                     |                                                                         |                                      |         |                      |            |       | 
  40 |           3 |    |     |       |    |               |     |     |                     |                        |            |                                     |                                                                         |                                      |         |                      |            |       | 
  40 |           3 |    |     |       |    |               |     |     |                     |                        |            |                                     |                                                                         |                                      |         |                      |            |       | 
  40 |          29 |    |     |       |    |               |     |     |                     |                        |            |                                     |                                                                         |                                      |         |                      |            |       | 
 100 |           2 |    |   2 |  2000 |    |               |     |     |                     |                        |            |                                     |                                                                         |                                      |         |                      |            |       | 
 100 |           4 |    |     |  2000 |    | test          | 200 |   0 |                     |                        |            |                                     |                                                                         |                                      |         |                      |            |       | 
 110 |           6 |    |     |       |    |               |     |     |                     |                        |            |                                     |                                                                         |                                      |         |                      |            |       | 
 110 |           8 |    |     |       |    |               |     |     |                     |                        |            |                                     |                                                                         |                                      |         |                      |            |       | 
     |             |    |     |       |    |               |     |     |                     |                        |            |                                     |                                                                         |                                      |         |                      |            |       | 
     |             |    |     |       |    |               |     |     |                     |                        |            |                                     |                                                                         |                                      |         |                      |            |       | 
(26 rows)

-- correlated sub-SELECT:
--Testcase 56:
UPDATE tntbl4 o
  SET (c9, c4) = (SELECT c9+1, c4 FROM tntbl4 i
               where i.c9=o.c9 and i.c4=o.c4 and i.c1 is not distinct FROM o.c1);
--Testcase 57:
SELECT c1, char_length(c2), c3, c4, c5, c6, c7, c8, c9, c10, c11, c12, c13, c14, c15, c16, c17, c18, c19, c20 FROM tntbl4 ORDER BY c1, c2, c3, c4, c5;
 c1  | char_length | c3 | c4  |  c5   | c6 |      c7       | c8  | c9  |         c10         |          c11           |    c12     |                 c13                 |                                   c14                                   |                 c15                  |   c16   |         c17          |    c18     |  c19  |                     c20                      
-----+-------------+----+-----+-------+----+---------------+-----+-----+---------------------+------------------------+------------+-------------------------------------+-------------------------------------------------------------------------+--------------------------------------+---------+----------------------+------------+-------+----------------------------------------------
  -1 |             |    |     |  4000 |    |               |     |     |                     |                        |            |                                     |                                                                         |                                      |         |                      |            |       | 
   3 |             |    |     |       |    |               |     |     |                     |                        |            |                                     |                                                                         |                                      |         |                      |            |       | 
   4 |           5 |    |     |       |    |               |     |     |                     |                        |            |                                     |                                                                         |                                      |         |                      |            |       | 
   5 |             |    |  10 |  1000 |    | char varying  | 100 | 128 | 2004-10-19 10:23:54 | 2004-10-19 08:23:54+00 | 0001-01-01 | { "customer": "John Does"}          | {"tags": ["tag1", "tag2"], "finished": true}                            | 2f404849-f62c-4234-b0c8-e230bd694045 | (1,-45) | \xa7a8a9aaabacadaeaf | 1111111111 | 10101 | @ 6 years 5 mons 4 days 3 hours 2 mins 1 sec
   9 |             |    |     |       |    |               |     |     |                     |                        |            |                                     |                                                                         |                                      |         |                      |            |       | 
  10 |           4 |    |  10 |  1000 |    | varchar array |  -1 |  13 | 2004-10-19 10:23:54 | 2004-10-19 08:23:54+00 | 2001-01-01 | {"product": "test","quantity": 1}   | {"name": "paintings", "tags": ["Scene", "Portrait"], "finished": true}  | 2f404849-f62c-4234-b0c8-e230bd694045 | (1,-45) | \xa7a8a9aaabacadaeaf | 1111111111 | 10101 | @ 1 year 3 hours 20 mins
  12 |           5 |    |     |  5000 |    |               |     |     |                     |                        |            |                                     |                                                                         |                                      |         |                      |            |       | 
  13 |           6 |    |     |  6000 |    |               |     |     |                     |                        |            |                                     |                                                                         |                                      |         |                      |            |       | 
  13 |             |    |     |       |    |               |     |     |                     |                        |            |                                     |                                                                         |                                      |         |                      |            |       | 
  14 |           9 |    |     |       |    |               |     |     |                     |                        |            |                                     |                                                                         |                                      |         |                      |            |       | 
  15 |             |    |     |       |    |               |     |     |                     |                        |            |                                     |                                                                         |                                      |         |                      |            |       | 
  20 |           8 |    |     |       |    |               |     |     |                     |                        |            |                                     |                                                                         |                                      |         |                      |            |       | 
  20 |           8 |    | -10 | 10010 |    | varchar array |   1 |   2 | 2005-10-19 10:23:54 | 2005-10-19 08:23:54+00 | 2001-01-01 | {"product": "sample","quantity": 1} | {"name": "paintings", "tags": ["Scene", "Portrait"], "finished": false} | 2f404849-f62c-4234-b0c8-e230bd694045 | (1,-45) | \xa7a8a9aaabacadaeaf | 1111111111 | 10101 | @ 1 year 3 hours 20 mins
  22 |           9 |    |     |       |    |               |     |     |                     |                        |            |                                     |                                                                         |                                      |         |                      |            |       | 
  23 |          10 |    |     |       |    |               |     |     |                     |                        |            |                                     |                                                                         |                                      |         |                      |            |       | 
  40 |           3 |    |     | 10040 |    |               |     |     |                     |                        |            |                                     |                                                                         |                                      |         |                      |            |       | 
  40 |           3 |    |     |       |    |               |     |     |                     |                        |            |                                     |                                                                         |                                      |         |                      |            |       | 
  40 |           3 |    |     |       |    |               |     |     |                     |                        |            |                                     |                                                                         |                                      |         |                      |            |       | 
  40 |           3 |    |     |       |    |               |     |     |                     |                        |            |                                     |                                                                         |                                      |         |                      |            |       | 
  40 |          29 |    |     |       |    |               |     |     |                     |                        |            |                                     |                                                                         |                                      |         |                      |            |       | 
 100 |           2 |    |     |  2000 |    |               |     |     |                     |                        |            |                                     |                                                                         |                                      |         |                      |            |       | 
 100 |           4 |    |     |  2000 |    | test          | 200 |     |                     |                        |            |                                     |                                                                         |                                      |         |                      |            |       | 
 110 |           6 |    |     |       |    |               |     |     |                     |                        |            |                                     |                                                                         |                                      |         |                      |            |       | 
 110 |           8 |    |     |       |    |               |     |     |                     |                        |            |                                     |                                                                         |                                      |         |                      |            |       | 
     |             |    |     |       |    |               |     |     |                     |                        |            |                                     |                                                                         |                                      |         |                      |            |       | 
     |             |    |     |       |    |               |     |     |                     |                        |            |                                     |                                                                         |                                      |         |                      |            |       | 
(26 rows)

-- fail, multiple rows supplied:
--Testcase 58:
UPDATE tntbl4 SET (c1, c9) = (SELECT c9 + 1, c1 FROM tntbl4);
ERROR:  more than one row returned by a subquery used as an expression
-- set to null if no rows supplied:
--Testcase 59:
UPDATE tntbl4 SET (c1, c9) = (SELECT c9 + 1, c1 FROM tntbl4 where c5 = 2000)
  WHERE c9 = 127;
--Testcase 60:
SELECT c1, char_length(c2), c3, c4, c5, c6, c7, c8, c9, c10, c11, c12, c13, c14, c15, c16, c17, c18, c19, c20 FROM tntbl4 ORDER BY c1, c2, c3, c4, c5;
 c1  | char_length | c3 | c4  |  c5   | c6 |      c7       | c8  | c9  |         c10         |          c11           |    c12     |                 c13                 |                                   c14                                   |                 c15                  |   c16   |         c17          |    c18     |  c19  |                     c20                      
-----+-------------+----+-----+-------+----+---------------+-----+-----+---------------------+------------------------+------------+-------------------------------------+-------------------------------------------------------------------------+--------------------------------------+---------+----------------------+------------+-------+----------------------------------------------
  -1 |             |    |     |  4000 |    |               |     |     |                     |                        |            |                                     |                                                                         |                                      |         |                      |            |       | 
   3 |             |    |     |       |    |               |     |     |                     |                        |            |                                     |                                                                         |                                      |         |                      |            |       | 
   4 |           5 |    |     |       |    |               |     |     |                     |                        |            |                                     |                                                                         |                                      |         |                      |            |       | 
   5 |             |    |  10 |  1000 |    | char varying  | 100 | 128 | 2004-10-19 10:23:54 | 2004-10-19 08:23:54+00 | 0001-01-01 | { "customer": "John Does"}          | {"tags": ["tag1", "tag2"], "finished": true}                            | 2f404849-f62c-4234-b0c8-e230bd694045 | (1,-45) | \xa7a8a9aaabacadaeaf | 1111111111 | 10101 | @ 6 years 5 mons 4 days 3 hours 2 mins 1 sec
   9 |             |    |     |       |    |               |     |     |                     |                        |            |                                     |                                                                         |                                      |         |                      |            |       | 
  10 |           4 |    |  10 |  1000 |    | varchar array |  -1 |  13 | 2004-10-19 10:23:54 | 2004-10-19 08:23:54+00 | 2001-01-01 | {"product": "test","quantity": 1}   | {"name": "paintings", "tags": ["Scene", "Portrait"], "finished": true}  | 2f404849-f62c-4234-b0c8-e230bd694045 | (1,-45) | \xa7a8a9aaabacadaeaf | 1111111111 | 10101 | @ 1 year 3 hours 20 mins
  12 |           5 |    |     |  5000 |    |               |     |     |                     |                        |            |                                     |                                                                         |                                      |         |                      |            |       | 
  13 |           6 |    |     |  6000 |    |               |     |     |                     |                        |            |                                     |                                                                         |                                      |         |                      |            |       | 
  13 |             |    |     |       |    |               |     |     |                     |                        |            |                                     |                                                                         |                                      |         |                      |            |       | 
  14 |           9 |    |     |       |    |               |     |     |                     |                        |            |                                     |                                                                         |                                      |         |                      |            |       | 
  15 |             |    |     |       |    |               |     |     |                     |                        |            |                                     |                                                                         |                                      |         |                      |            |       | 
  20 |           8 |    |     |       |    |               |     |     |                     |                        |            |                                     |                                                                         |                                      |         |                      |            |       | 
  20 |           8 |    | -10 | 10010 |    | varchar array |   1 |   2 | 2005-10-19 10:23:54 | 2005-10-19 08:23:54+00 | 2001-01-01 | {"product": "sample","quantity": 1} | {"name": "paintings", "tags": ["Scene", "Portrait"], "finished": false} | 2f404849-f62c-4234-b0c8-e230bd694045 | (1,-45) | \xa7a8a9aaabacadaeaf | 1111111111 | 10101 | @ 1 year 3 hours 20 mins
  22 |           9 |    |     |       |    |               |     |     |                     |                        |            |                                     |                                                                         |                                      |         |                      |            |       | 
  23 |          10 |    |     |       |    |               |     |     |                     |                        |            |                                     |                                                                         |                                      |         |                      |            |       | 
  40 |           3 |    |     | 10040 |    |               |     |     |                     |                        |            |                                     |                                                                         |                                      |         |                      |            |       | 
  40 |           3 |    |     |       |    |               |     |     |                     |                        |            |                                     |                                                                         |                                      |         |                      |            |       | 
  40 |           3 |    |     |       |    |               |     |     |                     |                        |            |                                     |                                                                         |                                      |         |                      |            |       | 
  40 |           3 |    |     |       |    |               |     |     |                     |                        |            |                                     |                                                                         |                                      |         |                      |            |       | 
  40 |          29 |    |     |       |    |               |     |     |                     |                        |            |                                     |                                                                         |                                      |         |                      |            |       | 
 100 |           2 |    |     |  2000 |    |               |     |     |                     |                        |            |                                     |                                                                         |                                      |         |                      |            |       | 
 100 |           4 |    |     |  2000 |    | test          | 200 |     |                     |                        |            |                                     |                                                                         |                                      |         |                      |            |       | 
 110 |           6 |    |     |       |    |               |     |     |                     |                        |            |                                     |                                                                         |                                      |         |                      |            |       | 
 110 |           8 |    |     |       |    |               |     |     |                     |                        |            |                                     |                                                                         |                                      |         |                      |            |       | 
     |             |    |     |       |    |               |     |     |                     |                        |            |                                     |                                                                         |                                      |         |                      |            |       | 
     |             |    |     |       |    |               |     |     |                     |                        |            |                                     |                                                                         |                                      |         |                      |            |       | 
(26 rows)

-- *-expansion should work in this context:
--Testcase 61:
UPDATE tntbl4 SET (c1, c9) = ROW(v.*) FROM (VALUES(20, 100)) AS v(i, j)
  WHERE tntbl4.c1 = v.i;
-- you might expect this to work, but syntactically it's not a RowExpr:
--Testcase 62:
UPDATE tntbl4 SET (c1, c9) = (v.*) FROM (VALUES(20, 101)) AS v(i, j)
  WHERE tntbl4.c1 = v.i;
ERROR:  source for a multiple-column UPDATE item must be a sub-SELECT or ROW() expression
LINE 1: UPDATE tntbl4 SET (c1, c9) = (v.*) FROM (VALUES(20, 101)) AS...
                                      ^
-- if an alias for the target table is specified, don't allow references
-- to the original table name
--Testcase 63:
UPDATE tntbl4 AS t SET c9 = tntbl4.c9 + 10 WHERE t.c1 = 40;
ERROR:  invalid reference to FROM-clause entry for table "tntbl4"
LINE 1: UPDATE tntbl4 AS t SET c9 = tntbl4.c9 + 10 WHERE t.c1 = 40;
                                    ^
HINT:  Perhaps you meant to reference the table alias "t".
-- Make sure that we can update to a TOASTed value.
--Testcase 64:
UPDATE tntbl4 SET c2 = repeat('x', 25) WHERE c2 = 'car';
--Testcase 65:
SELECT c1, c3, char_length(c2) FROM tntbl4 ORDER BY c1, c2, c3, c4, c5;
 c1  | c3 | char_length 
-----+----+-------------
  -1 |    |            
   3 |    |            
   4 |    |           5
   5 |    |            
   9 |    |            
  10 |    |           4
  12 |    |           5
  13 |    |           6
  13 |    |            
  14 |    |           9
  15 |    |            
  20 |    |           8
  20 |    |           8
  22 |    |           9
  23 |    |          10
  40 |    |          25
  40 |    |          25
  40 |    |          25
  40 |    |          25
  40 |    |          29
 100 |    |           2
 100 |    |           4
 110 |    |           6
 110 |    |           8
     |    |            
     |    |            
(26 rows)

-- Check multi-assignment with a Result node to handle a one-time filter.
--Testcase 66:
EXPLAIN (VERBOSE, COSTS OFF)
UPDATE tntbl4 t
  SET (c5, c1) = (SELECT c1, c5 FROM tntbl4 s WHERE s.c1 = t.c1)
  WHERE CURRENT_USER = SESSION_USER;
                                                                            QUERY PLAN                                                                            
------------------------------------------------------------------------------------------------------------------------------------------------------------------
 Update on public.tntbl4 t
   Node: postgres_svr_2 / Status: Alive
     Remote SQL: UPDATE public.tntbl4 SET c1 = $2, c5 = $3 WHERE ctid = $1
   Node: postgres_svr / Status: Alive
     Remote SQL: UPDATE public.tntbl4 SET c1 = $2, c5 = $3 WHERE ctid = $1
   ->  Result
         Output: (($2)::integer), (($1)::bigint), ((SubPlan 1 (returns $1,$2))), t.ctid, t.ctid, t.__spd_url, t.*
         One-Time Filter: (CURRENT_USER = SESSION_USER)
         ->  Foreign Scan on public.tntbl4 t
               Output: $2, $1, (SubPlan 1 (returns $1,$2)), t.ctid, t.ctid, t.__spd_url, t.*
               Filter: (CURRENT_USER = SESSION_USER)
               Node: postgres_svr_2 / Status: Alive
                 Remote SQL: SELECT c1, c2, c3, c4, c5, c6, c7, c8, c9, c10, c11, c12, c13, c14, c15, c16, c17, c18, c19, c20, ctid FROM public.tntbl4 FOR UPDATE
               Node: postgres_svr / Status: Alive
                 Remote SQL: SELECT c1, c2, c3, c4, c5, c6, c7, c8, c9, c10, c11, c12, c13, c14, c15, c16, c17, c18, c19, c20, ctid FROM public.tntbl4 FOR UPDATE
               SubPlan 1 (returns $1,$2)
                 ->  Foreign Scan on public.tntbl4 s
                       Output: s.c1, s.c5
                       Node: postgres_svr_2 / Status: Alive
                         Remote SQL: SELECT c1, c5 FROM public.tntbl4 WHERE ((c1 = $1::integer))
                       Node: postgres_svr / Status: Alive
                         Remote SQL: SELECT c1, c5 FROM public.tntbl4 WHERE ((c1 = $1::integer))
(22 rows)

--Testcase 67:
UPDATE tntbl4 t
  SET (c5, c1) = (SELECT c1, c5 FROM tntbl4 s WHERE s.c1 = t.c1)
  WHERE CURRENT_USER = SESSION_USER;
ERROR:  more than one row returned by a subquery used as an expression
--Testcase 68:
SELECT c1, c5, char_length(c2) FROM tntbl4 ORDER BY c1, c2, c3, c4, c5;
 c1  |  c5   | char_length 
-----+-------+-------------
  -1 |  4000 |            
   3 |       |            
   4 |       |           5
   5 |  1000 |            
   9 |       |            
  10 |  1000 |           4
  12 |  5000 |           5
  13 |  6000 |           6
  13 |       |            
  14 |       |           9
  15 |       |            
  20 |       |           8
  20 | 10010 |           8
  22 |       |           9
  23 |       |          10
  40 | 10040 |          25
  40 |       |          25
  40 |       |          25
  40 |       |          25
  40 |       |          29
 100 |  2000 |           2
 100 |  2000 |           4
 110 |       |           6
 110 |       |           8
     |       |            
     |       |            
(26 rows)

--
-- Check behavior of disable_transaction_feature_check
--
--Testcase 82:
ALTER FOREIGN TABLE tntbl4 OPTIONS (disable_transaction_feature_check 'true');
--
-- UPDATE with IN feature
--
--Testcase 69:
UPDATE tntbl4 IN ('/postgres_svr/') SET c8 = 56563.1212;
SELECT * FROM tntbl4 ORDER BY c1, c2, c3, c4, c5, c8, __spd_url;
 c1  |              c2               | c3 | c4  |  c5   | c6 |      c7       |     c8     | c9  |         c10         |          c11           |    c12     |                 c13                 |                                   c14                                   |                 c15                  |   c16   |         c17          |    c18     |  c19  |                     c20                      |    __spd_url     
-----+-------------------------------+----+-----+-------+----+---------------+------------+-----+---------------------+------------------------+------------+-------------------------------------+-------------------------------------------------------------------------+--------------------------------------+---------+----------------------+------------+-------+----------------------------------------------+------------------
  -1 |                               |    |     |  4000 |    |               |            |     |                     |                        |            |                                     |                                                                         |                                      |         |                      |            |       |                                              | /postgres_svr_2/
   3 |                               |    |     |       |    |               | 56563.1212 |     |                     |                        |            |                                     |                                                                         |                                      |         |                      |            |       |                                              | /postgres_svr/
   4 | ANC#$                         |    |     |       |    |               |            |     |                     |                        |            |                                     |                                                                         |                                      |         |                      |            |       |                                              | /postgres_svr_2/
   5 |                               |    |  10 |  1000 |    | char varying  | 56563.1212 | 128 | 2004-10-19 10:23:54 | 2004-10-19 08:23:54+00 | 0001-01-01 | { "customer": "John Does"}          | {"tags": ["tag1", "tag2"], "finished": true}                            | 2f404849-f62c-4234-b0c8-e230bd694045 | (1,-45) | \xa7a8a9aaabacadaeaf | 1111111111 | 10101 | @ 6 years 5 mons 4 days 3 hours 2 mins 1 sec | /postgres_svr/
   9 |                               |    |     |       |    |               | 56563.1212 |     |                     |                        |            |                                     |                                                                         |                                      |         |                      |            |       |                                              | /postgres_svr/
  10 | text                          |    |  10 |  1000 |    | varchar array | 56563.1212 |  13 | 2004-10-19 10:23:54 | 2004-10-19 08:23:54+00 | 2001-01-01 | {"product": "test","quantity": 1}   | {"name": "paintings", "tags": ["Scene", "Portrait"], "finished": true}  | 2f404849-f62c-4234-b0c8-e230bd694045 | (1,-45) | \xa7a8a9aaabacadaeaf | 1111111111 | 10101 | @ 1 year 3 hours 20 mins                     | /postgres_svr/
  12 | _test                         |    |     |  5000 |    |               | 56563.1212 |     |                     |                        |            |                                     |                                                                         |                                      |         |                      |            |       |                                              | /postgres_svr/
  13 | _infea                        |    |     |  6000 |    |               |            |     |                     |                        |            |                                     |                                                                         |                                      |         |                      |            |       |                                              | /postgres_svr_2/
  13 |                               |    |     |       |    |               |            |     |                     |                        |            |                                     |                                                                         |                                      |         |                      |            |       |                                              | /postgres_svr_2/
  14 | ANC#$next                     |    |     |       |    |               | 56563.1212 |     |                     |                        |            |                                     |                                                                         |                                      |         |                      |            |       |                                              | /postgres_svr/
  15 |                               |    |     |       |    |               |            |     |                     |                        |            |                                     |                                                                         |                                      |         |                      |            |       |                                              | /postgres_svr_2/
  20 | textnext                      |    |     |       |    |               | 56563.1212 | 100 |                     |                        |            |                                     |                                                                         |                                      |         |                      |            |       |                                              | /postgres_svr/
  20 | texttext                      |    | -10 | 10010 |    | varchar array |          1 | 100 | 2005-10-19 10:23:54 | 2005-10-19 08:23:54+00 | 2001-01-01 | {"product": "sample","quantity": 1} | {"name": "paintings", "tags": ["Scene", "Portrait"], "finished": false} | 2f404849-f62c-4234-b0c8-e230bd694045 | (1,-45) | \xa7a8a9aaabacadaeaf | 1111111111 | 10101 | @ 1 year 3 hours 20 mins                     | /postgres_svr_2/
  22 | _testnext                     |    |     |       |    |               |            |     |                     |                        |            |                                     |                                                                         |                                      |         |                      |            |       |                                              | /postgres_svr_2/
  23 | _infeanext                    |    |     |       |    |               | 56563.1212 |     |                     |                        |            |                                     |                                                                         |                                      |         |                      |            |       |                                              | /postgres_svr/
  40 | xxxxxxxxxxxxxxxxxxxxxxxxx     |    |     | 10040 |    |               | 56563.1212 |     |                     |                        |            |                                     |                                                                         |                                      |         |                      |            |       |                                              | /postgres_svr/
  40 | xxxxxxxxxxxxxxxxxxxxxxxxx     |    |     |       |    |               | 56563.1212 |     |                     |                        |            |                                     |                                                                         |                                      |         |                      |            |       |                                              | /postgres_svr/
  40 | xxxxxxxxxxxxxxxxxxxxxxxxx     |    |     |       |    |               |            |     |                     |                        |            |                                     |                                                                         |                                      |         |                      |            |       |                                              | /postgres_svr_2/
  40 | xxxxxxxxxxxxxxxxxxxxxxxxx     |    |     |       |    |               |            |     |                     |                        |            |                                     |                                                                         |                                      |         |                      |            |       |                                              | /postgres_svr_2/
  40 | xxxxxxxxxxxxxxxxxxxxxxxxxnext |    |     |       |    |               |            |     |                     |                        |            |                                     |                                                                         |                                      |         |                      |            |       |                                              | /postgres_svr_2/
 100 | 40                            |    |     |  2000 |    |               | 56563.1212 |     |                     |                        |            |                                     |                                                                         |                                      |         |                      |            |       |                                              | /postgres_svr/
 100 | test                          |    |     |  2000 |    | test          |        200 |     |                     |                        |            |                                     |                                                                         |                                      |         |                      |            |       |                                              | /postgres_svr_2/
 110 | 40next                        |    |     |       |    |               | 56563.1212 |     |                     |                        |            |                                     |                                                                         |                                      |         |                      |            |       |                                              | /postgres_svr/
 110 | testnext                      |    |     |       |    |               |            |     |                     |                        |            |                                     |                                                                         |                                      |         |                      |            |       |                                              | /postgres_svr_2/
     |                               |    |     |       |    |               | 56563.1212 |     |                     |                        |            |                                     |                                                                         |                                      |         |                      |            |       |                                              | /postgres_svr/
     |                               |    |     |       |    |               |            |     |                     |                        |            |                                     |                                                                         |                                      |         |                      |            |       |                                              | /postgres_svr_2/
(26 rows)

--Testcase 70:
UPDATE tntbl4 IN ('/postgres_svr/', '/postgres_svr_2/') SET c8 = 22.2;
SELECT * FROM tntbl4 ORDER BY c1, c2, c3, c4, c5, c8, __spd_url;
 c1  |              c2               | c3 | c4  |  c5   | c6 |      c7       |  c8  | c9  |         c10         |          c11           |    c12     |                 c13                 |                                   c14                                   |                 c15                  |   c16   |         c17          |    c18     |  c19  |                     c20                      |    __spd_url     
-----+-------------------------------+----+-----+-------+----+---------------+------+-----+---------------------+------------------------+------------+-------------------------------------+-------------------------------------------------------------------------+--------------------------------------+---------+----------------------+------------+-------+----------------------------------------------+------------------
  -1 |                               |    |     |  4000 |    |               | 22.2 |     |                     |                        |            |                                     |                                                                         |                                      |         |                      |            |       |                                              | /postgres_svr_2/
   3 |                               |    |     |       |    |               | 22.2 |     |                     |                        |            |                                     |                                                                         |                                      |         |                      |            |       |                                              | /postgres_svr/
   4 | ANC#$                         |    |     |       |    |               | 22.2 |     |                     |                        |            |                                     |                                                                         |                                      |         |                      |            |       |                                              | /postgres_svr_2/
   5 |                               |    |  10 |  1000 |    | char varying  | 22.2 | 128 | 2004-10-19 10:23:54 | 2004-10-19 08:23:54+00 | 0001-01-01 | { "customer": "John Does"}          | {"tags": ["tag1", "tag2"], "finished": true}                            | 2f404849-f62c-4234-b0c8-e230bd694045 | (1,-45) | \xa7a8a9aaabacadaeaf | 1111111111 | 10101 | @ 6 years 5 mons 4 days 3 hours 2 mins 1 sec | /postgres_svr/
   9 |                               |    |     |       |    |               | 22.2 |     |                     |                        |            |                                     |                                                                         |                                      |         |                      |            |       |                                              | /postgres_svr/
  10 | text                          |    |  10 |  1000 |    | varchar array | 22.2 |  13 | 2004-10-19 10:23:54 | 2004-10-19 08:23:54+00 | 2001-01-01 | {"product": "test","quantity": 1}   | {"name": "paintings", "tags": ["Scene", "Portrait"], "finished": true}  | 2f404849-f62c-4234-b0c8-e230bd694045 | (1,-45) | \xa7a8a9aaabacadaeaf | 1111111111 | 10101 | @ 1 year 3 hours 20 mins                     | /postgres_svr/
  12 | _test                         |    |     |  5000 |    |               | 22.2 |     |                     |                        |            |                                     |                                                                         |                                      |         |                      |            |       |                                              | /postgres_svr/
  13 | _infea                        |    |     |  6000 |    |               | 22.2 |     |                     |                        |            |                                     |                                                                         |                                      |         |                      |            |       |                                              | /postgres_svr_2/
  13 |                               |    |     |       |    |               | 22.2 |     |                     |                        |            |                                     |                                                                         |                                      |         |                      |            |       |                                              | /postgres_svr_2/
  14 | ANC#$next                     |    |     |       |    |               | 22.2 |     |                     |                        |            |                                     |                                                                         |                                      |         |                      |            |       |                                              | /postgres_svr/
  15 |                               |    |     |       |    |               | 22.2 |     |                     |                        |            |                                     |                                                                         |                                      |         |                      |            |       |                                              | /postgres_svr_2/
  20 | textnext                      |    |     |       |    |               | 22.2 | 100 |                     |                        |            |                                     |                                                                         |                                      |         |                      |            |       |                                              | /postgres_svr/
  20 | texttext                      |    | -10 | 10010 |    | varchar array | 22.2 | 100 | 2005-10-19 10:23:54 | 2005-10-19 08:23:54+00 | 2001-01-01 | {"product": "sample","quantity": 1} | {"name": "paintings", "tags": ["Scene", "Portrait"], "finished": false} | 2f404849-f62c-4234-b0c8-e230bd694045 | (1,-45) | \xa7a8a9aaabacadaeaf | 1111111111 | 10101 | @ 1 year 3 hours 20 mins                     | /postgres_svr_2/
  22 | _testnext                     |    |     |       |    |               | 22.2 |     |                     |                        |            |                                     |                                                                         |                                      |         |                      |            |       |                                              | /postgres_svr_2/
  23 | _infeanext                    |    |     |       |    |               | 22.2 |     |                     |                        |            |                                     |                                                                         |                                      |         |                      |            |       |                                              | /postgres_svr/
  40 | xxxxxxxxxxxxxxxxxxxxxxxxx     |    |     | 10040 |    |               | 22.2 |     |                     |                        |            |                                     |                                                                         |                                      |         |                      |            |       |                                              | /postgres_svr/
  40 | xxxxxxxxxxxxxxxxxxxxxxxxx     |    |     |       |    |               | 22.2 |     |                     |                        |            |                                     |                                                                         |                                      |         |                      |            |       |                                              | /postgres_svr/
  40 | xxxxxxxxxxxxxxxxxxxxxxxxx     |    |     |       |    |               | 22.2 |     |                     |                        |            |                                     |                                                                         |                                      |         |                      |            |       |                                              | /postgres_svr_2/
  40 | xxxxxxxxxxxxxxxxxxxxxxxxx     |    |     |       |    |               | 22.2 |     |                     |                        |            |                                     |                                                                         |                                      |         |                      |            |       |                                              | /postgres_svr_2/
  40 | xxxxxxxxxxxxxxxxxxxxxxxxxnext |    |     |       |    |               | 22.2 |     |                     |                        |            |                                     |                                                                         |                                      |         |                      |            |       |                                              | /postgres_svr_2/
 100 | 40                            |    |     |  2000 |    |               | 22.2 |     |                     |                        |            |                                     |                                                                         |                                      |         |                      |            |       |                                              | /postgres_svr/
 100 | test                          |    |     |  2000 |    | test          | 22.2 |     |                     |                        |            |                                     |                                                                         |                                      |         |                      |            |       |                                              | /postgres_svr_2/
 110 | 40next                        |    |     |       |    |               | 22.2 |     |                     |                        |            |                                     |                                                                         |                                      |         |                      |            |       |                                              | /postgres_svr/
 110 | testnext                      |    |     |       |    |               | 22.2 |     |                     |                        |            |                                     |                                                                         |                                      |         |                      |            |       |                                              | /postgres_svr_2/
     |                               |    |     |       |    |               | 22.2 |     |                     |                        |            |                                     |                                                                         |                                      |         |                      |            |       |                                              | /postgres_svr/
     |                               |    |     |       |    |               | 22.2 |     |                     |                        |            |                                     |                                                                         |                                      |         |                      |            |       |                                              | /postgres_svr_2/
(26 rows)

--
-- DELETE
--
-- allow an alias to be specified for DELETE's target table
--Testcase 71:
DELETE FROM tntbl4 AS dt WHERE dt.c1 > 75;
--Testcase 72:
SELECT c1, c3, char_length(c2) FROM tntbl4 ORDER BY c1, c2, c3, c4, c5;
 c1 | c3 | char_length 
----+----+-------------
 -1 |    |            
  3 |    |            
  4 |    |           5
  5 |    |            
  9 |    |            
 10 |    |           4
 12 |    |           5
 13 |    |           6
 13 |    |            
 14 |    |           9
 15 |    |            
 20 |    |           8
 20 |    |           8
 22 |    |           9
 23 |    |          10
 40 |    |          25
 40 |    |          25
 40 |    |          25
 40 |    |          25
 40 |    |          29
    |    |            
    |    |            
(22 rows)

-- if an alias is specified, don't allow the original table name
-- to be referenced
--Testcase 73:
DELETE FROM tntbl4 dt WHERE tntbl4.c1 > 45;
ERROR:  invalid reference to FROM-clause entry for table "tntbl4"
LINE 1: DELETE FROM tntbl4 dt WHERE tntbl4.c1 > 45;
                                    ^
HINT:  Perhaps you meant to reference the table alias "dt".
--Testcase 74:
SELECT c1, c3, char_length(c2) FROM tntbl4 ORDER BY c1, c2, c3, c4, c5;
 c1 | c3 | char_length 
----+----+-------------
 -1 |    |            
  3 |    |            
  4 |    |           5
  5 |    |            
  9 |    |            
 10 |    |           4
 12 |    |           5
 13 |    |           6
 13 |    |            
 14 |    |           9
 15 |    |            
 20 |    |           8
 20 |    |           8
 22 |    |           9
 23 |    |          10
 40 |    |          25
 40 |    |          25
 40 |    |          25
 40 |    |          25
 40 |    |          29
    |    |            
    |    |            
(22 rows)

-- delete a row with a TOASTed value
--Testcase 75:
DELETE FROM tntbl4 WHERE c1 > 25;
--Testcase 76:
SELECT c1, c3, char_length(c2) FROM tntbl4 ORDER BY c1, c2, c3, c4, c5;
 c1 | c3 | char_length 
----+----+-------------
 -1 |    |            
  3 |    |            
  4 |    |           5
  5 |    |            
  9 |    |            
 10 |    |           4
 12 |    |           5
 13 |    |           6
 13 |    |            
 14 |    |           9
 15 |    |            
 20 |    |           8
 20 |    |           8
 22 |    |           9
 23 |    |          10
    |    |            
    |    |            
(17 rows)

--
-- DELETE with IN feature
--
--Testcase 77:
DELETE FROM tntbl4 IN ('/postgres_svr/') WHERE c1 = 10;
--Testcase 78:
SELECT c1, c3, char_length(c2) FROM tntbl4 ORDER BY c1, c2, c3, c4, c5;
 c1 | c3 | char_length 
----+----+-------------
 -1 |    |            
  3 |    |            
  4 |    |           5
  5 |    |            
  9 |    |            
 12 |    |           5
 13 |    |           6
 13 |    |            
 14 |    |           9
 15 |    |            
 20 |    |           8
 20 |    |           8
 22 |    |           9
 23 |    |          10
    |    |            
    |    |            
(16 rows)

--Testcase 79:
DELETE FROM tntbl4 IN ('/postgres_svr/', '/postgres_svr_2/', '/griddb_svr/') WHERE c5 = 3000;
--Testcase 80:
SELECT c1, c3, char_length(c2) FROM tntbl4 ORDER BY c1, c2, c3, c4, c5;
 c1 | c3 | char_length 
----+----+-------------
 -1 |    |            
  3 |    |            
  4 |    |           5
  5 |    |            
  9 |    |            
 12 |    |           5
 13 |    |           6
 13 |    |            
 14 |    |           9
 15 |    |            
 20 |    |           8
 20 |    |           8
 22 |    |           9
 23 |    |          10
    |    |            
    |    |            
(16 rows)

--Testcase 81:
ALTER FOREIGN TABLE tntbl4 OPTIONS (SET disable_transaction_feature_check 'false');
--
-- Test with optional options: tntbl4
--
--
--
-- ON CONFLICT, this work only on postgres_fdw
--
--Testcase 83:
INSERT INTO tntbl4(c1, c2) VALUES(14, 'key$');  -- duplicate key
--Testcase 84:
INSERT INTO tntbl4(c1, c2) VALUES(14, 'key$') ON CONFLICT DO NOTHING; -- works
ERROR:  ON CONFLICT clause is not supported
--Testcase 85:
SELECT * FROM tntbl4 ORDER BY c1, c2, c3, c4, c5, __spd_url;
 c1 |     c2     | c3 | c4  |  c5   | c6 |      c7       |  c8  | c9  |         c10         |          c11           |    c12     |                 c13                 |                                   c14                                   |                 c15                  |   c16   |         c17          |    c18     |  c19  |                     c20                      |    __spd_url     
----+------------+----+-----+-------+----+---------------+------+-----+---------------------+------------------------+------------+-------------------------------------+-------------------------------------------------------------------------+--------------------------------------+---------+----------------------+------------+-------+----------------------------------------------+------------------
 -1 |            |    |     |  4000 |    |               | 22.2 |     |                     |                        |            |                                     |                                                                         |                                      |         |                      |            |       |                                              | /postgres_svr_2/
  3 |            |    |     |       |    |               | 22.2 |     |                     |                        |            |                                     |                                                                         |                                      |         |                      |            |       |                                              | /postgres_svr/
  4 | ANC#$      |    |     |       |    |               | 22.2 |     |                     |                        |            |                                     |                                                                         |                                      |         |                      |            |       |                                              | /postgres_svr_2/
  5 |            |    |  10 |  1000 |    | char varying  | 22.2 | 128 | 2004-10-19 10:23:54 | 2004-10-19 08:23:54+00 | 0001-01-01 | { "customer": "John Does"}          | {"tags": ["tag1", "tag2"], "finished": true}                            | 2f404849-f62c-4234-b0c8-e230bd694045 | (1,-45) | \xa7a8a9aaabacadaeaf | 1111111111 | 10101 | @ 6 years 5 mons 4 days 3 hours 2 mins 1 sec | /postgres_svr/
  9 |            |    |     |       |    |               | 22.2 |     |                     |                        |            |                                     |                                                                         |                                      |         |                      |            |       |                                              | /postgres_svr/
 12 | _test      |    |     |  5000 |    |               | 22.2 |     |                     |                        |            |                                     |                                                                         |                                      |         |                      |            |       |                                              | /postgres_svr/
 13 | _infea     |    |     |  6000 |    |               | 22.2 |     |                     |                        |            |                                     |                                                                         |                                      |         |                      |            |       |                                              | /postgres_svr_2/
 13 |            |    |     |       |    |               | 22.2 |     |                     |                        |            |                                     |                                                                         |                                      |         |                      |            |       |                                              | /postgres_svr_2/
 14 | ANC#$next  |    |     |       |    |               | 22.2 |     |                     |                        |            |                                     |                                                                         |                                      |         |                      |            |       |                                              | /postgres_svr/
 14 | key$       |    |     |       |    |               |      |     |                     |                        |            |                                     |                                                                         |                                      |         |                      |            |       |                                              | /postgres_svr_2/
 15 |            |    |     |       |    |               | 22.2 |     |                     |                        |            |                                     |                                                                         |                                      |         |                      |            |       |                                              | /postgres_svr_2/
 20 | textnext   |    |     |       |    |               | 22.2 | 100 |                     |                        |            |                                     |                                                                         |                                      |         |                      |            |       |                                              | /postgres_svr/
 20 | texttext   |    | -10 | 10010 |    | varchar array | 22.2 | 100 | 2005-10-19 10:23:54 | 2005-10-19 08:23:54+00 | 2001-01-01 | {"product": "sample","quantity": 1} | {"name": "paintings", "tags": ["Scene", "Portrait"], "finished": false} | 2f404849-f62c-4234-b0c8-e230bd694045 | (1,-45) | \xa7a8a9aaabacadaeaf | 1111111111 | 10101 | @ 1 year 3 hours 20 mins                     | /postgres_svr_2/
 22 | _testnext  |    |     |       |    |               | 22.2 |     |                     |                        |            |                                     |                                                                         |                                      |         |                      |            |       |                                              | /postgres_svr_2/
 23 | _infeanext |    |     |       |    |               | 22.2 |     |                     |                        |            |                                     |                                                                         |                                      |         |                      |            |       |                                              | /postgres_svr/
    |            |    |     |       |    |               | 22.2 |     |                     |                        |            |                                     |                                                                         |                                      |         |                      |            |       |                                              | /postgres_svr/
    |            |    |     |       |    |               | 22.2 |     |                     |                        |            |                                     |                                                                         |                                      |         |                      |            |       |                                              | /postgres_svr_2/
(17 rows)

--Testcase 86:
INSERT INTO tntbl4(c1, c2) VALUES(14, 'key$') ON CONFLICT (c1, c2) DO NOTHING; -- unsupported
ERROR:  there is no unique or exclusion constraint matching the ON CONFLICT specification
--Testcase 87:
INSERT INTO tntbl4(c1, c2) VALUES(14, 'key$') ON CONFLICT (c1, c2) DO UPDATE SET c4 = 5.0; -- unsupported
ERROR:  there is no unique or exclusion constraint matching the ON CONFLICT specification
--
-- WITH CHECK, this work only on postgres_fdw
--
--Testcase 88:
CREATE VIEW rw_view AS SELECT * FROM tntbl4
  WHERE c1 < c5 ORDER BY c1 WITH CHECK OPTION;
--Testcase 89:
\d+ rw_view
                                       View "public.rw_view"
  Column   |            Type             | Collation | Nullable | Default | Storage  | Description 
-----------+-----------------------------+-----------+----------+---------+----------+-------------
 c1        | integer                     |           |          |         | plain    | 
 c2        | text                        |           |          |         | extended | 
 c3        | boolean                     |           |          |         | plain    | 
 c4        | double precision            |           |          |         | plain    | 
 c5        | bigint                      |           |          |         | plain    | 
 c6        | character(255)              |           |          |         | extended | 
 c7        | character varying(255)      |           |          |         | extended | 
 c8        | double precision            |           |          |         | plain    | 
 c9        | smallint                    |           |          |         | plain    | 
 c10       | timestamp without time zone |           |          |         | plain    | 
 c11       | timestamp with time zone    |           |          |         | plain    | 
 c12       | date                        |           |          |         | plain    | 
 c13       | json                        |           |          |         | extended | 
 c14       | jsonb                       |           |          |         | extended | 
 c15       | uuid                        |           |          |         | plain    | 
 c16       | point                       |           |          |         | plain    | 
 c17       | bytea                       |           |          |         | extended | 
 c18       | bit(10)                     |           |          |         | extended | 
 c19       | bit varying(10)             |           |          |         | extended | 
 c20       | interval                    |           |          |         | plain    | 
 __spd_url | text                        |           |          |         | extended | 
View definition:
 SELECT c1,
    c2,
    c3,
    c4,
    c5,
    c6,
    c7,
    c8,
    c9,
    c10,
    c11,
    c12,
    c13,
    c14,
    c15,
    c16,
    c17,
    c18,
    c19,
    c20,
    __spd_url
   FROM tntbl4
  WHERE c1 < c5
  ORDER BY c1;
Options: check_option=cascaded

--Testcase 90:
EXPLAIN (VERBOSE, COSTS OFF)
INSERT INTO rw_view(c1, c5) VALUES (15, 0);
ERROR:  WITH CHECK clause is not supported
--Testcase 91:
INSERT INTO rw_view(c1, c5) VALUES (15, 0); -- should fail
ERROR:  WITH CHECK clause is not supported
--Testcase 92:
EXPLAIN (VERBOSE, COSTS OFF)
INSERT INTO rw_view(c1, c5) VALUES (15, 3000);
ERROR:  WITH CHECK clause is not supported
--Testcase 93:
INSERT INTO rw_view(c1, c5) VALUES (15, 3000); -- ok
ERROR:  WITH CHECK clause is not supported
--Testcase 94:
SELECT c1, char_length(c2), c3, c4, c5, c6, c7, c8, c9, c10, c11, c12, c13, c14, c15, c16, c17, c18, c19, c20 FROM tntbl4 ORDER BY 1, 2, 3, 4, 5;
 c1 | char_length | c3 | c4  |  c5   | c6 |      c7       |  c8  | c9  |         c10         |          c11           |    c12     |                 c13                 |                                   c14                                   |                 c15                  |   c16   |         c17          |    c18     |  c19  |                     c20                      
----+-------------+----+-----+-------+----+---------------+------+-----+---------------------+------------------------+------------+-------------------------------------+-------------------------------------------------------------------------+--------------------------------------+---------+----------------------+------------+-------+----------------------------------------------
 -1 |             |    |     |  4000 |    |               | 22.2 |     |                     |                        |            |                                     |                                                                         |                                      |         |                      |            |       | 
  3 |             |    |     |       |    |               | 22.2 |     |                     |                        |            |                                     |                                                                         |                                      |         |                      |            |       | 
  4 |           5 |    |     |       |    |               | 22.2 |     |                     |                        |            |                                     |                                                                         |                                      |         |                      |            |       | 
  5 |             |    |  10 |  1000 |    | char varying  | 22.2 | 128 | 2004-10-19 10:23:54 | 2004-10-19 08:23:54+00 | 0001-01-01 | { "customer": "John Does"}          | {"tags": ["tag1", "tag2"], "finished": true}                            | 2f404849-f62c-4234-b0c8-e230bd694045 | (1,-45) | \xa7a8a9aaabacadaeaf | 1111111111 | 10101 | @ 6 years 5 mons 4 days 3 hours 2 mins 1 sec
  9 |             |    |     |       |    |               | 22.2 |     |                     |                        |            |                                     |                                                                         |                                      |         |                      |            |       | 
 12 |           5 |    |     |  5000 |    |               | 22.2 |     |                     |                        |            |                                     |                                                                         |                                      |         |                      |            |       | 
 13 |           6 |    |     |  6000 |    |               | 22.2 |     |                     |                        |            |                                     |                                                                         |                                      |         |                      |            |       | 
 13 |             |    |     |       |    |               | 22.2 |     |                     |                        |            |                                     |                                                                         |                                      |         |                      |            |       | 
 14 |           4 |    |     |       |    |               |      |     |                     |                        |            |                                     |                                                                         |                                      |         |                      |            |       | 
 14 |           9 |    |     |       |    |               | 22.2 |     |                     |                        |            |                                     |                                                                         |                                      |         |                      |            |       | 
 15 |             |    |     |       |    |               | 22.2 |     |                     |                        |            |                                     |                                                                         |                                      |         |                      |            |       | 
 20 |           8 |    | -10 | 10010 |    | varchar array | 22.2 | 100 | 2005-10-19 10:23:54 | 2005-10-19 08:23:54+00 | 2001-01-01 | {"product": "sample","quantity": 1} | {"name": "paintings", "tags": ["Scene", "Portrait"], "finished": false} | 2f404849-f62c-4234-b0c8-e230bd694045 | (1,-45) | \xa7a8a9aaabacadaeaf | 1111111111 | 10101 | @ 1 year 3 hours 20 mins
 20 |           8 |    |     |       |    |               | 22.2 | 100 |                     |                        |            |                                     |                                                                         |                                      |         |                      |            |       | 
 22 |           9 |    |     |       |    |               | 22.2 |     |                     |                        |            |                                     |                                                                         |                                      |         |                      |            |       | 
 23 |          10 |    |     |       |    |               | 22.2 |     |                     |                        |            |                                     |                                                                         |                                      |         |                      |            |       | 
    |             |    |     |       |    |               | 22.2 |     |                     |                        |            |                                     |                                                                         |                                      |         |                      |            |       | 
    |             |    |     |       |    |               | 22.2 |     |                     |                        |            |                                     |                                                                         |                                      |         |                      |            |       | 
(17 rows)

--Testcase 95:
EXPLAIN (VERBOSE, COSTS OFF)
UPDATE rw_view SET c1 = c1 + 10000;
ERROR:  WITH CHECK clause is not supported
--Testcase 96:
UPDATE rw_view SET c1 = c1 + 10000; -- should fail
ERROR:  WITH CHECK clause is not supported
--Testcase 97:
EXPLAIN (VERBOSE, COSTS OFF)
UPDATE rw_view SET c1 = c1 + 15;
ERROR:  WITH CHECK clause is not supported
--Testcase 98:
UPDATE rw_view SET c1 = c1 + 15; -- ok
ERROR:  WITH CHECK clause is not supported
--Testcase 99:
SELECT c1, char_length(c2), c3, c4, c5, c6, c7, c8, c9, c10, c11, c12, c13, c14, c15, c16, c17, c18, c19, c20 FROM tntbl4 ORDER BY c1, c2, c3, c4, c5;
 c1 | char_length | c3 | c4  |  c5   | c6 |      c7       |  c8  | c9  |         c10         |          c11           |    c12     |                 c13                 |                                   c14                                   |                 c15                  |   c16   |         c17          |    c18     |  c19  |                     c20                      
----+-------------+----+-----+-------+----+---------------+------+-----+---------------------+------------------------+------------+-------------------------------------+-------------------------------------------------------------------------+--------------------------------------+---------+----------------------+------------+-------+----------------------------------------------
 -1 |             |    |     |  4000 |    |               | 22.2 |     |                     |                        |            |                                     |                                                                         |                                      |         |                      |            |       | 
  3 |             |    |     |       |    |               | 22.2 |     |                     |                        |            |                                     |                                                                         |                                      |         |                      |            |       | 
  4 |           5 |    |     |       |    |               | 22.2 |     |                     |                        |            |                                     |                                                                         |                                      |         |                      |            |       | 
  5 |             |    |  10 |  1000 |    | char varying  | 22.2 | 128 | 2004-10-19 10:23:54 | 2004-10-19 08:23:54+00 | 0001-01-01 | { "customer": "John Does"}          | {"tags": ["tag1", "tag2"], "finished": true}                            | 2f404849-f62c-4234-b0c8-e230bd694045 | (1,-45) | \xa7a8a9aaabacadaeaf | 1111111111 | 10101 | @ 6 years 5 mons 4 days 3 hours 2 mins 1 sec
  9 |             |    |     |       |    |               | 22.2 |     |                     |                        |            |                                     |                                                                         |                                      |         |                      |            |       | 
 12 |           5 |    |     |  5000 |    |               | 22.2 |     |                     |                        |            |                                     |                                                                         |                                      |         |                      |            |       | 
 13 |           6 |    |     |  6000 |    |               | 22.2 |     |                     |                        |            |                                     |                                                                         |                                      |         |                      |            |       | 
 13 |             |    |     |       |    |               | 22.2 |     |                     |                        |            |                                     |                                                                         |                                      |         |                      |            |       | 
 14 |           9 |    |     |       |    |               | 22.2 |     |                     |                        |            |                                     |                                                                         |                                      |         |                      |            |       | 
 14 |           4 |    |     |       |    |               |      |     |                     |                        |            |                                     |                                                                         |                                      |         |                      |            |       | 
 15 |             |    |     |       |    |               | 22.2 |     |                     |                        |            |                                     |                                                                         |                                      |         |                      |            |       | 
 20 |           8 |    |     |       |    |               | 22.2 | 100 |                     |                        |            |                                     |                                                                         |                                      |         |                      |            |       | 
 20 |           8 |    | -10 | 10010 |    | varchar array | 22.2 | 100 | 2005-10-19 10:23:54 | 2005-10-19 08:23:54+00 | 2001-01-01 | {"product": "sample","quantity": 1} | {"name": "paintings", "tags": ["Scene", "Portrait"], "finished": false} | 2f404849-f62c-4234-b0c8-e230bd694045 | (1,-45) | \xa7a8a9aaabacadaeaf | 1111111111 | 10101 | @ 1 year 3 hours 20 mins
 22 |           9 |    |     |       |    |               | 22.2 |     |                     |                        |            |                                     |                                                                         |                                      |         |                      |            |       | 
 23 |          10 |    |     |       |    |               | 22.2 |     |                     |                        |            |                                     |                                                                         |                                      |         |                      |            |       | 
    |             |    |     |       |    |               | 22.2 |     |                     |                        |            |                                     |                                                                         |                                      |         |                      |            |       | 
    |             |    |     |       |    |               | 22.2 |     |                     |                        |            |                                     |                                                                         |                                      |         |                      |            |       | 
(17 rows)

--Testcase 100:
DROP VIEW rw_view;
--
-- RETURNING
--
--Testcase 101:
INSERT INTO tntbl4 VALUES (70, '0000', true, 5.0, 5000) RETURNING *;
ERROR:  RETURNING clause is not supported
--Testcase 102:
INSERT INTO tntbl4 (c1, c2, c3, c4, c5) VALUES (80, '_key_', false, 4.0, 6000) RETURNING c1, c2, c3;
ERROR:  RETURNING clause is not supported
--Testcase 103:
UPDATE tntbl4 SET c4 = 7.0 WHERE c1 = 70 AND c3 = true RETURNING (tntbl4), *;
ERROR:  RETURNING clause is not supported
--Testcase 104:
DELETE FROM tntbl4 WHERE c3 = true RETURNING c1, c2, c3;
ERROR:  RETURNING clause is not supported
--Testcase 105:
DELETE FROM tntbl4 RETURNING *;
ERROR:  RETURNING clause is not supported
--
-- Test case bulk insert
--
--Clean
--Testcase 111:
DELETE FROM tntbl4;
--Testcase 112:
SELECT * FROM tntbl4;
 c1 | c2 | c3 | c4 | c5 | c6 | c7 | c8 | c9 | c10 | c11 | c12 | c13 | c14 | c15 | c16 | c17 | c18 | c19 | c20 | __spd_url 
----+----+----+----+----+----+----+----+----+-----+-----+-----+-----+-----+-----+-----+-----+-----+-----+-----+-----------
(0 rows)

SET client_min_messages = INFO;
-- Auto config: batch_size of FDW = 10, insert 30 records
ALTER SERVER postgres_svr OPTIONS (ADD batch_size '10');
ALTER SERVER postgres_svr_2 OPTIONS (ADD batch_size '10');
-- ALTER SERVER pgspider_svr OPTIONS (DROP batch_size);
--Testcase 113:
INSERT INTO tntbl4
	SELECT id, 'text' || id, true, id * 1.5, id * 1000, 'char array' || id, 'varchar array' || id, id / 5, id % 100,'1970-01-01 00:00:01'::timestamp + ((id % 100) || ' days')::interval, '1970-01-01 00:00:01'::timestamptz + ((id % 100) || ' days')::interval, '1970-01-01'::date + ((id % 100) || ' days')::interval, '{"product": "test","quantity": 1}', '{"name": "paintings", "tags": ["Scene", "Portrait"], "finished": true }', '2f404849-f62c-4234-b0c8-e230bd694045', point '(1,-45)', E'\\xa7a8a9aaabacadaeaf', B'1111111111', B'10101', interval '1 year 3 hours 20 minutes'	FROM generate_series(1, 30) id;
INFO:  Batch Insert for postgres_fdw, batch size = 10
INFO:  Batch Insert for postgres_fdw, batch size = 10
--Testcase 114:
SELECT * FROM tntbl4 ORDER BY 1,2;
 c1 |   c2   | c3 |  c4  |  c5   |                                                                                                                               c6                                                                                                                                |       c7        | c8 | c9 |         c10         |          c11           |    c12     |                c13                |                                  c14                                   |                 c15                  |   c16   |         c17          |    c18     |  c19  |           c20            |    __spd_url     
----+--------+----+------+-------+-----------------------------------------------------------------------------------------------------------------------------------------------------------------------------------------------------------------------------------------------------------------+-----------------+----+----+---------------------+------------------------+------------+-----------------------------------+------------------------------------------------------------------------+--------------------------------------+---------+----------------------+------------+-------+--------------------------+------------------
  1 | text1  | t  |  1.5 |  1000 | char array1                                                                                                                                                                                                                                                     | varchar array1  |  0 |  1 | 1970-01-02 00:00:01 | 1970-01-02 00:00:01+00 | 1970-01-02 | {"product": "test","quantity": 1} | {"name": "paintings", "tags": ["Scene", "Portrait"], "finished": true} | 2f404849-f62c-4234-b0c8-e230bd694045 | (1,-45) | \xa7a8a9aaabacadaeaf | 1111111111 | 10101 | @ 1 year 3 hours 20 mins | /postgres_svr/
  2 | text2  | t  |    3 |  2000 | char array2                                                                                                                                                                                                                                                     | varchar array2  |  0 |  2 | 1970-01-03 00:00:01 | 1970-01-03 00:00:01+00 | 1970-01-03 | {"product": "test","quantity": 1} | {"name": "paintings", "tags": ["Scene", "Portrait"], "finished": true} | 2f404849-f62c-4234-b0c8-e230bd694045 | (1,-45) | \xa7a8a9aaabacadaeaf | 1111111111 | 10101 | @ 1 year 3 hours 20 mins | /postgres_svr_2/
  3 | text3  | t  |  4.5 |  3000 | char array3                                                                                                                                                                                                                                                     | varchar array3  |  0 |  3 | 1970-01-04 00:00:01 | 1970-01-04 00:00:01+00 | 1970-01-04 | {"product": "test","quantity": 1} | {"name": "paintings", "tags": ["Scene", "Portrait"], "finished": true} | 2f404849-f62c-4234-b0c8-e230bd694045 | (1,-45) | \xa7a8a9aaabacadaeaf | 1111111111 | 10101 | @ 1 year 3 hours 20 mins | /postgres_svr/
  4 | text4  | t  |    6 |  4000 | char array4                                                                                                                                                                                                                                                     | varchar array4  |  0 |  4 | 1970-01-05 00:00:01 | 1970-01-05 00:00:01+00 | 1970-01-05 | {"product": "test","quantity": 1} | {"name": "paintings", "tags": ["Scene", "Portrait"], "finished": true} | 2f404849-f62c-4234-b0c8-e230bd694045 | (1,-45) | \xa7a8a9aaabacadaeaf | 1111111111 | 10101 | @ 1 year 3 hours 20 mins | /postgres_svr_2/
  5 | text5  | t  |  7.5 |  5000 | char array5                                                                                                                                                                                                                                                     | varchar array5  |  1 |  5 | 1970-01-06 00:00:01 | 1970-01-06 00:00:01+00 | 1970-01-06 | {"product": "test","quantity": 1} | {"name": "paintings", "tags": ["Scene", "Portrait"], "finished": true} | 2f404849-f62c-4234-b0c8-e230bd694045 | (1,-45) | \xa7a8a9aaabacadaeaf | 1111111111 | 10101 | @ 1 year 3 hours 20 mins | /postgres_svr/
  6 | text6  | t  |    9 |  6000 | char array6                                                                                                                                                                                                                                                     | varchar array6  |  1 |  6 | 1970-01-07 00:00:01 | 1970-01-07 00:00:01+00 | 1970-01-07 | {"product": "test","quantity": 1} | {"name": "paintings", "tags": ["Scene", "Portrait"], "finished": true} | 2f404849-f62c-4234-b0c8-e230bd694045 | (1,-45) | \xa7a8a9aaabacadaeaf | 1111111111 | 10101 | @ 1 year 3 hours 20 mins | /postgres_svr_2/
  7 | text7  | t  | 10.5 |  7000 | char array7                                                                                                                                                                                                                                                     | varchar array7  |  1 |  7 | 1970-01-08 00:00:01 | 1970-01-08 00:00:01+00 | 1970-01-08 | {"product": "test","quantity": 1} | {"name": "paintings", "tags": ["Scene", "Portrait"], "finished": true} | 2f404849-f62c-4234-b0c8-e230bd694045 | (1,-45) | \xa7a8a9aaabacadaeaf | 1111111111 | 10101 | @ 1 year 3 hours 20 mins | /postgres_svr/
  8 | text8  | t  |   12 |  8000 | char array8                                                                                                                                                                                                                                                     | varchar array8  |  1 |  8 | 1970-01-09 00:00:01 | 1970-01-09 00:00:01+00 | 1970-01-09 | {"product": "test","quantity": 1} | {"name": "paintings", "tags": ["Scene", "Portrait"], "finished": true} | 2f404849-f62c-4234-b0c8-e230bd694045 | (1,-45) | \xa7a8a9aaabacadaeaf | 1111111111 | 10101 | @ 1 year 3 hours 20 mins | /postgres_svr_2/
  9 | text9  | t  | 13.5 |  9000 | char array9                                                                                                                                                                                                                                                     | varchar array9  |  1 |  9 | 1970-01-10 00:00:01 | 1970-01-10 00:00:01+00 | 1970-01-10 | {"product": "test","quantity": 1} | {"name": "paintings", "tags": ["Scene", "Portrait"], "finished": true} | 2f404849-f62c-4234-b0c8-e230bd694045 | (1,-45) | \xa7a8a9aaabacadaeaf | 1111111111 | 10101 | @ 1 year 3 hours 20 mins | /postgres_svr/
 10 | text10 | t  |   15 | 10000 | char array10                                                                                                                                                                                                                                                    | varchar array10 |  2 | 10 | 1970-01-11 00:00:01 | 1970-01-11 00:00:01+00 | 1970-01-11 | {"product": "test","quantity": 1} | {"name": "paintings", "tags": ["Scene", "Portrait"], "finished": true} | 2f404849-f62c-4234-b0c8-e230bd694045 | (1,-45) | \xa7a8a9aaabacadaeaf | 1111111111 | 10101 | @ 1 year 3 hours 20 mins | /postgres_svr_2/
 11 | text11 | t  | 16.5 | 11000 | char array11                                                                                                                                                                                                                                                    | varchar array11 |  2 | 11 | 1970-01-12 00:00:01 | 1970-01-12 00:00:01+00 | 1970-01-12 | {"product": "test","quantity": 1} | {"name": "paintings", "tags": ["Scene", "Portrait"], "finished": true} | 2f404849-f62c-4234-b0c8-e230bd694045 | (1,-45) | \xa7a8a9aaabacadaeaf | 1111111111 | 10101 | @ 1 year 3 hours 20 mins | /postgres_svr/
 12 | text12 | t  |   18 | 12000 | char array12                                                                                                                                                                                                                                                    | varchar array12 |  2 | 12 | 1970-01-13 00:00:01 | 1970-01-13 00:00:01+00 | 1970-01-13 | {"product": "test","quantity": 1} | {"name": "paintings", "tags": ["Scene", "Portrait"], "finished": true} | 2f404849-f62c-4234-b0c8-e230bd694045 | (1,-45) | \xa7a8a9aaabacadaeaf | 1111111111 | 10101 | @ 1 year 3 hours 20 mins | /postgres_svr_2/
 13 | text13 | t  | 19.5 | 13000 | char array13                                                                                                                                                                                                                                                    | varchar array13 |  2 | 13 | 1970-01-14 00:00:01 | 1970-01-14 00:00:01+00 | 1970-01-14 | {"product": "test","quantity": 1} | {"name": "paintings", "tags": ["Scene", "Portrait"], "finished": true} | 2f404849-f62c-4234-b0c8-e230bd694045 | (1,-45) | \xa7a8a9aaabacadaeaf | 1111111111 | 10101 | @ 1 year 3 hours 20 mins | /postgres_svr/
 14 | text14 | t  |   21 | 14000 | char array14                                                                                                                                                                                                                                                    | varchar array14 |  2 | 14 | 1970-01-15 00:00:01 | 1970-01-15 00:00:01+00 | 1970-01-15 | {"product": "test","quantity": 1} | {"name": "paintings", "tags": ["Scene", "Portrait"], "finished": true} | 2f404849-f62c-4234-b0c8-e230bd694045 | (1,-45) | \xa7a8a9aaabacadaeaf | 1111111111 | 10101 | @ 1 year 3 hours 20 mins | /postgres_svr_2/
 15 | text15 | t  | 22.5 | 15000 | char array15                                                                                                                                                                                                                                                    | varchar array15 |  3 | 15 | 1970-01-16 00:00:01 | 1970-01-16 00:00:01+00 | 1970-01-16 | {"product": "test","quantity": 1} | {"name": "paintings", "tags": ["Scene", "Portrait"], "finished": true} | 2f404849-f62c-4234-b0c8-e230bd694045 | (1,-45) | \xa7a8a9aaabacadaeaf | 1111111111 | 10101 | @ 1 year 3 hours 20 mins | /postgres_svr/
 16 | text16 | t  |   24 | 16000 | char array16                                                                                                                                                                                                                                                    | varchar array16 |  3 | 16 | 1970-01-17 00:00:01 | 1970-01-17 00:00:01+00 | 1970-01-17 | {"product": "test","quantity": 1} | {"name": "paintings", "tags": ["Scene", "Portrait"], "finished": true} | 2f404849-f62c-4234-b0c8-e230bd694045 | (1,-45) | \xa7a8a9aaabacadaeaf | 1111111111 | 10101 | @ 1 year 3 hours 20 mins | /postgres_svr_2/
 17 | text17 | t  | 25.5 | 17000 | char array17                                                                                                                                                                                                                                                    | varchar array17 |  3 | 17 | 1970-01-18 00:00:01 | 1970-01-18 00:00:01+00 | 1970-01-18 | {"product": "test","quantity": 1} | {"name": "paintings", "tags": ["Scene", "Portrait"], "finished": true} | 2f404849-f62c-4234-b0c8-e230bd694045 | (1,-45) | \xa7a8a9aaabacadaeaf | 1111111111 | 10101 | @ 1 year 3 hours 20 mins | /postgres_svr/
 18 | text18 | t  |   27 | 18000 | char array18                                                                                                                                                                                                                                                    | varchar array18 |  3 | 18 | 1970-01-19 00:00:01 | 1970-01-19 00:00:01+00 | 1970-01-19 | {"product": "test","quantity": 1} | {"name": "paintings", "tags": ["Scene", "Portrait"], "finished": true} | 2f404849-f62c-4234-b0c8-e230bd694045 | (1,-45) | \xa7a8a9aaabacadaeaf | 1111111111 | 10101 | @ 1 year 3 hours 20 mins | /postgres_svr_2/
 19 | text19 | t  | 28.5 | 19000 | char array19                                                                                                                                                                                                                                                    | varchar array19 |  3 | 19 | 1970-01-20 00:00:01 | 1970-01-20 00:00:01+00 | 1970-01-20 | {"product": "test","quantity": 1} | {"name": "paintings", "tags": ["Scene", "Portrait"], "finished": true} | 2f404849-f62c-4234-b0c8-e230bd694045 | (1,-45) | \xa7a8a9aaabacadaeaf | 1111111111 | 10101 | @ 1 year 3 hours 20 mins | /postgres_svr/
 20 | text20 | t  |   30 | 20000 | char array20                                                                                                                                                                                                                                                    | varchar array20 |  4 | 20 | 1970-01-21 00:00:01 | 1970-01-21 00:00:01+00 | 1970-01-21 | {"product": "test","quantity": 1} | {"name": "paintings", "tags": ["Scene", "Portrait"], "finished": true} | 2f404849-f62c-4234-b0c8-e230bd694045 | (1,-45) | \xa7a8a9aaabacadaeaf | 1111111111 | 10101 | @ 1 year 3 hours 20 mins | /postgres_svr_2/
 21 | text21 | t  | 31.5 | 21000 | char array21                                                                                                                                                                                                                                                    | varchar array21 |  4 | 21 | 1970-01-22 00:00:01 | 1970-01-22 00:00:01+00 | 1970-01-22 | {"product": "test","quantity": 1} | {"name": "paintings", "tags": ["Scene", "Portrait"], "finished": true} | 2f404849-f62c-4234-b0c8-e230bd694045 | (1,-45) | \xa7a8a9aaabacadaeaf | 1111111111 | 10101 | @ 1 year 3 hours 20 mins | /postgres_svr/
 22 | text22 | t  |   33 | 22000 | char array22                                                                                                                                                                                                                                                    | varchar array22 |  4 | 22 | 1970-01-23 00:00:01 | 1970-01-23 00:00:01+00 | 1970-01-23 | {"product": "test","quantity": 1} | {"name": "paintings", "tags": ["Scene", "Portrait"], "finished": true} | 2f404849-f62c-4234-b0c8-e230bd694045 | (1,-45) | \xa7a8a9aaabacadaeaf | 1111111111 | 10101 | @ 1 year 3 hours 20 mins | /postgres_svr_2/
 23 | text23 | t  | 34.5 | 23000 | char array23                                                                                                                                                                                                                                                    | varchar array23 |  4 | 23 | 1970-01-24 00:00:01 | 1970-01-24 00:00:01+00 | 1970-01-24 | {"product": "test","quantity": 1} | {"name": "paintings", "tags": ["Scene", "Portrait"], "finished": true} | 2f404849-f62c-4234-b0c8-e230bd694045 | (1,-45) | \xa7a8a9aaabacadaeaf | 1111111111 | 10101 | @ 1 year 3 hours 20 mins | /postgres_svr/
 24 | text24 | t  |   36 | 24000 | char array24                                                                                                                                                                                                                                                    | varchar array24 |  4 | 24 | 1970-01-25 00:00:01 | 1970-01-25 00:00:01+00 | 1970-01-25 | {"product": "test","quantity": 1} | {"name": "paintings", "tags": ["Scene", "Portrait"], "finished": true} | 2f404849-f62c-4234-b0c8-e230bd694045 | (1,-45) | \xa7a8a9aaabacadaeaf | 1111111111 | 10101 | @ 1 year 3 hours 20 mins | /postgres_svr_2/
 25 | text25 | t  | 37.5 | 25000 | char array25                                                                                                                                                                                                                                                    | varchar array25 |  5 | 25 | 1970-01-26 00:00:01 | 1970-01-26 00:00:01+00 | 1970-01-26 | {"product": "test","quantity": 1} | {"name": "paintings", "tags": ["Scene", "Portrait"], "finished": true} | 2f404849-f62c-4234-b0c8-e230bd694045 | (1,-45) | \xa7a8a9aaabacadaeaf | 1111111111 | 10101 | @ 1 year 3 hours 20 mins | /postgres_svr/
 26 | text26 | t  |   39 | 26000 | char array26                                                                                                                                                                                                                                                    | varchar array26 |  5 | 26 | 1970-01-27 00:00:01 | 1970-01-27 00:00:01+00 | 1970-01-27 | {"product": "test","quantity": 1} | {"name": "paintings", "tags": ["Scene", "Portrait"], "finished": true} | 2f404849-f62c-4234-b0c8-e230bd694045 | (1,-45) | \xa7a8a9aaabacadaeaf | 1111111111 | 10101 | @ 1 year 3 hours 20 mins | /postgres_svr_2/
 27 | text27 | t  | 40.5 | 27000 | char array27                                                                                                                                                                                                                                                    | varchar array27 |  5 | 27 | 1970-01-28 00:00:01 | 1970-01-28 00:00:01+00 | 1970-01-28 | {"product": "test","quantity": 1} | {"name": "paintings", "tags": ["Scene", "Portrait"], "finished": true} | 2f404849-f62c-4234-b0c8-e230bd694045 | (1,-45) | \xa7a8a9aaabacadaeaf | 1111111111 | 10101 | @ 1 year 3 hours 20 mins | /postgres_svr/
 28 | text28 | t  |   42 | 28000 | char array28                                                                                                                                                                                                                                                    | varchar array28 |  5 | 28 | 1970-01-29 00:00:01 | 1970-01-29 00:00:01+00 | 1970-01-29 | {"product": "test","quantity": 1} | {"name": "paintings", "tags": ["Scene", "Portrait"], "finished": true} | 2f404849-f62c-4234-b0c8-e230bd694045 | (1,-45) | \xa7a8a9aaabacadaeaf | 1111111111 | 10101 | @ 1 year 3 hours 20 mins | /postgres_svr_2/
 29 | text29 | t  | 43.5 | 29000 | char array29                                                                                                                                                                                                                                                    | varchar array29 |  5 | 29 | 1970-01-30 00:00:01 | 1970-01-30 00:00:01+00 | 1970-01-30 | {"product": "test","quantity": 1} | {"name": "paintings", "tags": ["Scene", "Portrait"], "finished": true} | 2f404849-f62c-4234-b0c8-e230bd694045 | (1,-45) | \xa7a8a9aaabacadaeaf | 1111111111 | 10101 | @ 1 year 3 hours 20 mins | /postgres_svr/
 30 | text30 | t  |   45 | 30000 | char array30                                                                                                                                                                                                                                                    | varchar array30 |  6 | 30 | 1970-01-31 00:00:01 | 1970-01-31 00:00:01+00 | 1970-01-31 | {"product": "test","quantity": 1} | {"name": "paintings", "tags": ["Scene", "Portrait"], "finished": true} | 2f404849-f62c-4234-b0c8-e230bd694045 | (1,-45) | \xa7a8a9aaabacadaeaf | 1111111111 | 10101 | @ 1 year 3 hours 20 mins | /postgres_svr_2/
(30 rows)

--Testcase 115:
SELECT * FROM tntbl4__postgres_svr__0 ORDER BY 1,2;
 c1 |   c2   | c3 |  c4  |  c5   |                                                                                                                               c6                                                                                                                                |       c7        | c8 | c9 |         c10         |          c11           |    c12     |                c13                |                                  c14                                   |                 c15                  |   c16   |         c17          |    c18     |  c19  |           c20            
----+--------+----+------+-------+-----------------------------------------------------------------------------------------------------------------------------------------------------------------------------------------------------------------------------------------------------------------+-----------------+----+----+---------------------+------------------------+------------+-----------------------------------+------------------------------------------------------------------------+--------------------------------------+---------+----------------------+------------+-------+--------------------------
  1 | text1  | t  |  1.5 |  1000 | char array1                                                                                                                                                                                                                                                     | varchar array1  |  0 |  1 | 1970-01-02 00:00:01 | 1970-01-02 00:00:01+00 | 1970-01-02 | {"product": "test","quantity": 1} | {"name": "paintings", "tags": ["Scene", "Portrait"], "finished": true} | 2f404849-f62c-4234-b0c8-e230bd694045 | (1,-45) | \xa7a8a9aaabacadaeaf | 1111111111 | 10101 | @ 1 year 3 hours 20 mins
  3 | text3  | t  |  4.5 |  3000 | char array3                                                                                                                                                                                                                                                     | varchar array3  |  0 |  3 | 1970-01-04 00:00:01 | 1970-01-04 00:00:01+00 | 1970-01-04 | {"product": "test","quantity": 1} | {"name": "paintings", "tags": ["Scene", "Portrait"], "finished": true} | 2f404849-f62c-4234-b0c8-e230bd694045 | (1,-45) | \xa7a8a9aaabacadaeaf | 1111111111 | 10101 | @ 1 year 3 hours 20 mins
  5 | text5  | t  |  7.5 |  5000 | char array5                                                                                                                                                                                                                                                     | varchar array5  |  1 |  5 | 1970-01-06 00:00:01 | 1970-01-06 00:00:01+00 | 1970-01-06 | {"product": "test","quantity": 1} | {"name": "paintings", "tags": ["Scene", "Portrait"], "finished": true} | 2f404849-f62c-4234-b0c8-e230bd694045 | (1,-45) | \xa7a8a9aaabacadaeaf | 1111111111 | 10101 | @ 1 year 3 hours 20 mins
  7 | text7  | t  | 10.5 |  7000 | char array7                                                                                                                                                                                                                                                     | varchar array7  |  1 |  7 | 1970-01-08 00:00:01 | 1970-01-08 00:00:01+00 | 1970-01-08 | {"product": "test","quantity": 1} | {"name": "paintings", "tags": ["Scene", "Portrait"], "finished": true} | 2f404849-f62c-4234-b0c8-e230bd694045 | (1,-45) | \xa7a8a9aaabacadaeaf | 1111111111 | 10101 | @ 1 year 3 hours 20 mins
  9 | text9  | t  | 13.5 |  9000 | char array9                                                                                                                                                                                                                                                     | varchar array9  |  1 |  9 | 1970-01-10 00:00:01 | 1970-01-10 00:00:01+00 | 1970-01-10 | {"product": "test","quantity": 1} | {"name": "paintings", "tags": ["Scene", "Portrait"], "finished": true} | 2f404849-f62c-4234-b0c8-e230bd694045 | (1,-45) | \xa7a8a9aaabacadaeaf | 1111111111 | 10101 | @ 1 year 3 hours 20 mins
 11 | text11 | t  | 16.5 | 11000 | char array11                                                                                                                                                                                                                                                    | varchar array11 |  2 | 11 | 1970-01-12 00:00:01 | 1970-01-12 00:00:01+00 | 1970-01-12 | {"product": "test","quantity": 1} | {"name": "paintings", "tags": ["Scene", "Portrait"], "finished": true} | 2f404849-f62c-4234-b0c8-e230bd694045 | (1,-45) | \xa7a8a9aaabacadaeaf | 1111111111 | 10101 | @ 1 year 3 hours 20 mins
 13 | text13 | t  | 19.5 | 13000 | char array13                                                                                                                                                                                                                                                    | varchar array13 |  2 | 13 | 1970-01-14 00:00:01 | 1970-01-14 00:00:01+00 | 1970-01-14 | {"product": "test","quantity": 1} | {"name": "paintings", "tags": ["Scene", "Portrait"], "finished": true} | 2f404849-f62c-4234-b0c8-e230bd694045 | (1,-45) | \xa7a8a9aaabacadaeaf | 1111111111 | 10101 | @ 1 year 3 hours 20 mins
 15 | text15 | t  | 22.5 | 15000 | char array15                                                                                                                                                                                                                                                    | varchar array15 |  3 | 15 | 1970-01-16 00:00:01 | 1970-01-16 00:00:01+00 | 1970-01-16 | {"product": "test","quantity": 1} | {"name": "paintings", "tags": ["Scene", "Portrait"], "finished": true} | 2f404849-f62c-4234-b0c8-e230bd694045 | (1,-45) | \xa7a8a9aaabacadaeaf | 1111111111 | 10101 | @ 1 year 3 hours 20 mins
 17 | text17 | t  | 25.5 | 17000 | char array17                                                                                                                                                                                                                                                    | varchar array17 |  3 | 17 | 1970-01-18 00:00:01 | 1970-01-18 00:00:01+00 | 1970-01-18 | {"product": "test","quantity": 1} | {"name": "paintings", "tags": ["Scene", "Portrait"], "finished": true} | 2f404849-f62c-4234-b0c8-e230bd694045 | (1,-45) | \xa7a8a9aaabacadaeaf | 1111111111 | 10101 | @ 1 year 3 hours 20 mins
 19 | text19 | t  | 28.5 | 19000 | char array19                                                                                                                                                                                                                                                    | varchar array19 |  3 | 19 | 1970-01-20 00:00:01 | 1970-01-20 00:00:01+00 | 1970-01-20 | {"product": "test","quantity": 1} | {"name": "paintings", "tags": ["Scene", "Portrait"], "finished": true} | 2f404849-f62c-4234-b0c8-e230bd694045 | (1,-45) | \xa7a8a9aaabacadaeaf | 1111111111 | 10101 | @ 1 year 3 hours 20 mins
 21 | text21 | t  | 31.5 | 21000 | char array21                                                                                                                                                                                                                                                    | varchar array21 |  4 | 21 | 1970-01-22 00:00:01 | 1970-01-22 00:00:01+00 | 1970-01-22 | {"product": "test","quantity": 1} | {"name": "paintings", "tags": ["Scene", "Portrait"], "finished": true} | 2f404849-f62c-4234-b0c8-e230bd694045 | (1,-45) | \xa7a8a9aaabacadaeaf | 1111111111 | 10101 | @ 1 year 3 hours 20 mins
 23 | text23 | t  | 34.5 | 23000 | char array23                                                                                                                                                                                                                                                    | varchar array23 |  4 | 23 | 1970-01-24 00:00:01 | 1970-01-24 00:00:01+00 | 1970-01-24 | {"product": "test","quantity": 1} | {"name": "paintings", "tags": ["Scene", "Portrait"], "finished": true} | 2f404849-f62c-4234-b0c8-e230bd694045 | (1,-45) | \xa7a8a9aaabacadaeaf | 1111111111 | 10101 | @ 1 year 3 hours 20 mins
 25 | text25 | t  | 37.5 | 25000 | char array25                                                                                                                                                                                                                                                    | varchar array25 |  5 | 25 | 1970-01-26 00:00:01 | 1970-01-26 00:00:01+00 | 1970-01-26 | {"product": "test","quantity": 1} | {"name": "paintings", "tags": ["Scene", "Portrait"], "finished": true} | 2f404849-f62c-4234-b0c8-e230bd694045 | (1,-45) | \xa7a8a9aaabacadaeaf | 1111111111 | 10101 | @ 1 year 3 hours 20 mins
 27 | text27 | t  | 40.5 | 27000 | char array27                                                                                                                                                                                                                                                    | varchar array27 |  5 | 27 | 1970-01-28 00:00:01 | 1970-01-28 00:00:01+00 | 1970-01-28 | {"product": "test","quantity": 1} | {"name": "paintings", "tags": ["Scene", "Portrait"], "finished": true} | 2f404849-f62c-4234-b0c8-e230bd694045 | (1,-45) | \xa7a8a9aaabacadaeaf | 1111111111 | 10101 | @ 1 year 3 hours 20 mins
 29 | text29 | t  | 43.5 | 29000 | char array29                                                                                                                                                                                                                                                    | varchar array29 |  5 | 29 | 1970-01-30 00:00:01 | 1970-01-30 00:00:01+00 | 1970-01-30 | {"product": "test","quantity": 1} | {"name": "paintings", "tags": ["Scene", "Portrait"], "finished": true} | 2f404849-f62c-4234-b0c8-e230bd694045 | (1,-45) | \xa7a8a9aaabacadaeaf | 1111111111 | 10101 | @ 1 year 3 hours 20 mins
(15 rows)

--Testcase 116:
SELECT * FROM tntbl4__postgres_svr_2__0 ORDER BY 1,2;
 c1 |   c2   | c3 | c4 |  c5   |                                                                                                                               c6                                                                                                                                |       c7        | c8 | c9 |         c10         |          c11           |    c12     |                c13                |                                  c14                                   |                 c15                  |   c16   |         c17          |    c18     |  c19  |           c20            
----+--------+----+----+-------+-----------------------------------------------------------------------------------------------------------------------------------------------------------------------------------------------------------------------------------------------------------------+-----------------+----+----+---------------------+------------------------+------------+-----------------------------------+------------------------------------------------------------------------+--------------------------------------+---------+----------------------+------------+-------+--------------------------
  2 | text2  | t  |  3 |  2000 | char array2                                                                                                                                                                                                                                                     | varchar array2  |  0 |  2 | 1970-01-03 00:00:01 | 1970-01-03 00:00:01+00 | 1970-01-03 | {"product": "test","quantity": 1} | {"name": "paintings", "tags": ["Scene", "Portrait"], "finished": true} | 2f404849-f62c-4234-b0c8-e230bd694045 | (1,-45) | \xa7a8a9aaabacadaeaf | 1111111111 | 10101 | @ 1 year 3 hours 20 mins
  4 | text4  | t  |  6 |  4000 | char array4                                                                                                                                                                                                                                                     | varchar array4  |  0 |  4 | 1970-01-05 00:00:01 | 1970-01-05 00:00:01+00 | 1970-01-05 | {"product": "test","quantity": 1} | {"name": "paintings", "tags": ["Scene", "Portrait"], "finished": true} | 2f404849-f62c-4234-b0c8-e230bd694045 | (1,-45) | \xa7a8a9aaabacadaeaf | 1111111111 | 10101 | @ 1 year 3 hours 20 mins
  6 | text6  | t  |  9 |  6000 | char array6                                                                                                                                                                                                                                                     | varchar array6  |  1 |  6 | 1970-01-07 00:00:01 | 1970-01-07 00:00:01+00 | 1970-01-07 | {"product": "test","quantity": 1} | {"name": "paintings", "tags": ["Scene", "Portrait"], "finished": true} | 2f404849-f62c-4234-b0c8-e230bd694045 | (1,-45) | \xa7a8a9aaabacadaeaf | 1111111111 | 10101 | @ 1 year 3 hours 20 mins
  8 | text8  | t  | 12 |  8000 | char array8                                                                                                                                                                                                                                                     | varchar array8  |  1 |  8 | 1970-01-09 00:00:01 | 1970-01-09 00:00:01+00 | 1970-01-09 | {"product": "test","quantity": 1} | {"name": "paintings", "tags": ["Scene", "Portrait"], "finished": true} | 2f404849-f62c-4234-b0c8-e230bd694045 | (1,-45) | \xa7a8a9aaabacadaeaf | 1111111111 | 10101 | @ 1 year 3 hours 20 mins
 10 | text10 | t  | 15 | 10000 | char array10                                                                                                                                                                                                                                                    | varchar array10 |  2 | 10 | 1970-01-11 00:00:01 | 1970-01-11 00:00:01+00 | 1970-01-11 | {"product": "test","quantity": 1} | {"name": "paintings", "tags": ["Scene", "Portrait"], "finished": true} | 2f404849-f62c-4234-b0c8-e230bd694045 | (1,-45) | \xa7a8a9aaabacadaeaf | 1111111111 | 10101 | @ 1 year 3 hours 20 mins
 12 | text12 | t  | 18 | 12000 | char array12                                                                                                                                                                                                                                                    | varchar array12 |  2 | 12 | 1970-01-13 00:00:01 | 1970-01-13 00:00:01+00 | 1970-01-13 | {"product": "test","quantity": 1} | {"name": "paintings", "tags": ["Scene", "Portrait"], "finished": true} | 2f404849-f62c-4234-b0c8-e230bd694045 | (1,-45) | \xa7a8a9aaabacadaeaf | 1111111111 | 10101 | @ 1 year 3 hours 20 mins
 14 | text14 | t  | 21 | 14000 | char array14                                                                                                                                                                                                                                                    | varchar array14 |  2 | 14 | 1970-01-15 00:00:01 | 1970-01-15 00:00:01+00 | 1970-01-15 | {"product": "test","quantity": 1} | {"name": "paintings", "tags": ["Scene", "Portrait"], "finished": true} | 2f404849-f62c-4234-b0c8-e230bd694045 | (1,-45) | \xa7a8a9aaabacadaeaf | 1111111111 | 10101 | @ 1 year 3 hours 20 mins
 16 | text16 | t  | 24 | 16000 | char array16                                                                                                                                                                                                                                                    | varchar array16 |  3 | 16 | 1970-01-17 00:00:01 | 1970-01-17 00:00:01+00 | 1970-01-17 | {"product": "test","quantity": 1} | {"name": "paintings", "tags": ["Scene", "Portrait"], "finished": true} | 2f404849-f62c-4234-b0c8-e230bd694045 | (1,-45) | \xa7a8a9aaabacadaeaf | 1111111111 | 10101 | @ 1 year 3 hours 20 mins
 18 | text18 | t  | 27 | 18000 | char array18                                                                                                                                                                                                                                                    | varchar array18 |  3 | 18 | 1970-01-19 00:00:01 | 1970-01-19 00:00:01+00 | 1970-01-19 | {"product": "test","quantity": 1} | {"name": "paintings", "tags": ["Scene", "Portrait"], "finished": true} | 2f404849-f62c-4234-b0c8-e230bd694045 | (1,-45) | \xa7a8a9aaabacadaeaf | 1111111111 | 10101 | @ 1 year 3 hours 20 mins
 20 | text20 | t  | 30 | 20000 | char array20                                                                                                                                                                                                                                                    | varchar array20 |  4 | 20 | 1970-01-21 00:00:01 | 1970-01-21 00:00:01+00 | 1970-01-21 | {"product": "test","quantity": 1} | {"name": "paintings", "tags": ["Scene", "Portrait"], "finished": true} | 2f404849-f62c-4234-b0c8-e230bd694045 | (1,-45) | \xa7a8a9aaabacadaeaf | 1111111111 | 10101 | @ 1 year 3 hours 20 mins
 22 | text22 | t  | 33 | 22000 | char array22                                                                                                                                                                                                                                                    | varchar array22 |  4 | 22 | 1970-01-23 00:00:01 | 1970-01-23 00:00:01+00 | 1970-01-23 | {"product": "test","quantity": 1} | {"name": "paintings", "tags": ["Scene", "Portrait"], "finished": true} | 2f404849-f62c-4234-b0c8-e230bd694045 | (1,-45) | \xa7a8a9aaabacadaeaf | 1111111111 | 10101 | @ 1 year 3 hours 20 mins
 24 | text24 | t  | 36 | 24000 | char array24                                                                                                                                                                                                                                                    | varchar array24 |  4 | 24 | 1970-01-25 00:00:01 | 1970-01-25 00:00:01+00 | 1970-01-25 | {"product": "test","quantity": 1} | {"name": "paintings", "tags": ["Scene", "Portrait"], "finished": true} | 2f404849-f62c-4234-b0c8-e230bd694045 | (1,-45) | \xa7a8a9aaabacadaeaf | 1111111111 | 10101 | @ 1 year 3 hours 20 mins
 26 | text26 | t  | 39 | 26000 | char array26                                                                                                                                                                                                                                                    | varchar array26 |  5 | 26 | 1970-01-27 00:00:01 | 1970-01-27 00:00:01+00 | 1970-01-27 | {"product": "test","quantity": 1} | {"name": "paintings", "tags": ["Scene", "Portrait"], "finished": true} | 2f404849-f62c-4234-b0c8-e230bd694045 | (1,-45) | \xa7a8a9aaabacadaeaf | 1111111111 | 10101 | @ 1 year 3 hours 20 mins
 28 | text28 | t  | 42 | 28000 | char array28                                                                                                                                                                                                                                                    | varchar array28 |  5 | 28 | 1970-01-29 00:00:01 | 1970-01-29 00:00:01+00 | 1970-01-29 | {"product": "test","quantity": 1} | {"name": "paintings", "tags": ["Scene", "Portrait"], "finished": true} | 2f404849-f62c-4234-b0c8-e230bd694045 | (1,-45) | \xa7a8a9aaabacadaeaf | 1111111111 | 10101 | @ 1 year 3 hours 20 mins
 30 | text30 | t  | 45 | 30000 | char array30                                                                                                                                                                                                                                                    | varchar array30 |  6 | 30 | 1970-01-31 00:00:01 | 1970-01-31 00:00:01+00 | 1970-01-31 | {"product": "test","quantity": 1} | {"name": "paintings", "tags": ["Scene", "Portrait"], "finished": true} | 2f404849-f62c-4234-b0c8-e230bd694045 | (1,-45) | \xa7a8a9aaabacadaeaf | 1111111111 | 10101 | @ 1 year 3 hours 20 mins
(15 rows)

--Clean
DELETE FROM tntbl4__postgres_svr__0;
DELETE FROM tntbl4__postgres_svr_2__0;
--Reset data
INSERT INTO tntbl4__postgres_svr__0 VALUES (10, 'text', true, 10.0, 1000, 'char array', 'varchar array', -1.0, 12, '2004-10-19 10:23:54', '2004-10-19 10:23:54+02', '2001-01-01', '{"product": "test","quantity": 1}', '{"name": "paintings", "tags": ["Scene", "Portrait"], "finished": true }', '2f404849-f62c-4234-b0c8-e230bd694045', point '(1,-45)', E'\\xa7a8a9aaabacadaeaf', B'1111111111', B'10101', interval '1 year 3 hours 20 minutes');
INSERT INTO tntbl4__postgres_svr_2__0 VALUES (20, 'texttext', false, -10.0, -1000, 'char array', 'varchar array', 1.0, 1, '2005-10-19 10:23:54', '2005-10-19 10:23:54+02', '2001-01-01', '{"product": "sample","quantity": 1}', '{"name": "paintings", "tags": ["Scene", "Portrait"], "finished": false }', '2f404849-f62c-4234-b0c8-e230bd694045', point '(1,-45)', E'\\xa7a8a9aaabacadaeaf', B'1111111111', B'10101', interval '1 year 3 hours 20 minutes');
--Testcase 106:
DROP FOREIGN TABLE tntbl4 CASCADE;
--Testcase 107:
DROP USER MAPPING FOR CURRENT_USER SERVER pgspider_svr;
--Testcase 108:
DROP EXTENSION postgres_fdw CASCADE;
NOTICE:  drop cascades to 8 other objects
DETAIL:  drop cascades to server postgres_svr
drop cascades to user mapping for public on server postgres_svr
drop cascades to foreign table tntbl4__postgres_svr__0
drop cascades to server postgres_svr_1
drop cascades to user mapping for public on server postgres_svr_1
drop cascades to server postgres_svr_2
drop cascades to user mapping for public on server postgres_svr_2
drop cascades to foreign table tntbl4__postgres_svr_2__0
--Testcase 109:
DROP SERVER pgspider_svr CASCADE;
--Testcase 110:
DROP EXTENSION pgspider_core_fdw CASCADE;
