\set ECHO none
--Testcase 1:
SET datestyle = ISO;
--Testcase 2:
SET timezone = 'UTC';
--Testcase 3:
DELETE FROM pg_spd_node_info;
--Testcase 4:
CREATE EXTENSION pgspider_core_fdw;
--Testcase 5:
CREATE SERVER pgspider_svr FOREIGN DATA WRAPPER pgspider_core_fdw OPTIONS (host :PGSPIDER_SERVER1);
--Testcase 6:
CREATE USER MAPPING FOR CURRENT_USER SERVER pgspider_svr;
-- Extensions
--Testcase 7:
CREATE EXTENSION file_fdw;
--Testcase 8:
CREATE SERVER file_svr FOREIGN DATA WRAPPER file_fdw;
--Testcase 9:
CREATE SERVER file_svr_2 FOREIGN DATA WRAPPER file_fdw;
--Testcase 10:
CREATE FOREIGN TABLE tntbl5 (c1 int, c2 text, __spd_url text) SERVER pgspider_svr;
-- *** Start test for 1 node file_fdw *** --
--Testcase 11:
CREATE FOREIGN TABLE tntbl5__file_svr__0 (c1 int, c2 text) SERVER file_svr OPTIONS (filename '/tmp/pg_modify_file1.csv', format 'csv');
-- SELECT FROM table if there is any record
--Testcase 12:
SELECT * FROM tntbl5 ORDER BY 1;
 c1 |  c2  | __spd_url  
----+------+------------
 10 | test | /file_svr/
(1 row)

-- This FDW does not support modification, the result will fail all over
--Testcase 13:
INSERT INTO tntbl5 VALUES (DEFAULT, 'abc');
WARNING:  file_fdw is ignored as an insert target because it does not support modification
ERROR:  No child node support modification.
--Testcase 14:
INSERT INTO tntbl5 VALUES (1, 'foo');
WARNING:  file_fdw is ignored as an insert target because it does not support modification
ERROR:  No child node support modification.
--Testcase 15:
INSERT INTO tntbl5 IN ('/file_svr/') VALUES (2, 'zzzzz');
WARNING:  file_fdw is ignored as an insert target because it does not support modification
ERROR:  No child node support modification.
--Testcase 16:
UPDATE tntbl5 SET c2 = 'foo' WHERE c1 IS NULL;
WARNING:  file_fdw will be skipped because it does not support modification
ERROR:  No child node support modification.
--Testcase 17:
UPDATE tntbl5 IN ('/file_svr/', '/file_svr_2/') SET c2 = DEFAULT;
WARNING:  file_fdw will be skipped because it does not support modification
ERROR:  No child node support modification.
--Testcase 18:
DELETE FROM tntbl5 WHERE c2 = 'foo';
WARNING:  file_fdw will be skipped because it does not support modification
ERROR:  No child node support modification.
--Testcase 19:
DELETE FROM tntbl5 IN ('/file_svr/');
WARNING:  file_fdw will be skipped because it does not support modification
ERROR:  No child node support modification.
--
-- Test case bulk insert, 1 node file_fdw
--
--Testcase 34:
SET client_min_messages = INFO;
-- Manual config: batch_size server = 5, batch_size table not set, batch_size of FDW = 6, insert 10 records
--Testcase 35:
-- ALTER SERVER pgspider_svr OPTIONS (ADD batch_size '5');
--Testcase 36:
INSERT INTO tntbl5
	SELECT id, to_char(id, 'FM00000') FROM generate_series(1, 10) id;
WARNING:  file_fdw is ignored as an insert target because it does not support modification
ERROR:  No child node support modification.
--Testcase 37:
SELECT * FROM tntbl5 ORDER BY 1;
 c1 |  c2  | __spd_url  
----+------+------------
 10 | test | /file_svr/
(1 row)

-- Auto config: batch_size of FDW = 10, insert 25 records
--Testcase 38:
-- ALTER SERVER pgspider_svr OPTIONS (DROP batch_size);
--Testcase 39:
INSERT INTO tntbl5
	SELECT id, to_char(id, 'FM00000') FROM generate_series(11, 35) id;
WARNING:  file_fdw is ignored as an insert target because it does not support modification
ERROR:  No child node support modification.
--Testcase 40:
SELECT * FROM tntbl5 ORDER BY 1;
 c1 |  c2  | __spd_url  
----+------+------------
 10 | test | /file_svr/
(1 row)

-- *** Start test for 2 nodes file_fdw *** --
--Testcase 20:
CREATE FOREIGN TABLE tntbl5__file_svr__2 (c1 int, c2 text) SERVER file_svr_2 OPTIONS (filename '/tmp/pg_modify_file2.csv', format 'csv');
-- SELECT FROM table if there is any record
--Testcase 21:
SELECT * FROM tntbl5 ORDER BY 1;
 c1 |  c2  |  __spd_url   
----+------+--------------
 10 | test | /file_svr/
 40 | foo1 | /file_svr_2/
(2 rows)

-- This FDW does not support modification, the result will fail all over
--Testcase 22:
INSERT INTO tntbl5 VALUES (DEFAULT, 'abc');
WARNING:  file_fdw is ignored as an insert target because it does not support modification
WARNING:  file_fdw is ignored as an insert target because it does not support modification
ERROR:  No child node support modification.
--Testcase 23:
INSERT INTO tntbl5 VALUES (1, 'foo');
WARNING:  file_fdw is ignored as an insert target because it does not support modification
WARNING:  file_fdw is ignored as an insert target because it does not support modification
ERROR:  No child node support modification.
--Testcase 24:
INSERT INTO tntbl5 IN ('/file_svr/') VALUES (2, 'zzzzz');
WARNING:  file_fdw is ignored as an insert target because it does not support modification
ERROR:  No child node support modification.
--Testcase 25:
UPDATE tntbl5 SET c2 = 'foo' WHERE c1 IS NULL;
WARNING:  file_fdw will be skipped because it does not support modification
WARNING:  file_fdw will be skipped because it does not support modification
ERROR:  No child node support modification.
--Testcase 26:
UPDATE tntbl5 IN ('/file_svr/', '/file_svr_2/') SET c2 = DEFAULT;
WARNING:  file_fdw will be skipped because it does not support modification
WARNING:  file_fdw will be skipped because it does not support modification
ERROR:  No child node support modification.
--Testcase 27:
DELETE FROM tntbl5 WHERE c2 = 'foo';
WARNING:  file_fdw will be skipped because it does not support modification
WARNING:  file_fdw will be skipped because it does not support modification
ERROR:  No child node support modification.
--Testcase 28:
DELETE FROM tntbl5 IN ('/file_svr/');
WARNING:  file_fdw will be skipped because it does not support modification
ERROR:  No child node support modification.
--
-- Test case routing insert feature
--
-- Test in case of throw_candidate_error = false
--Testcase 47:
SET pgspider_core_fdw.throw_candidate_error = false;
-- First, single insert for nodes
--Testcase 48:
INSERT INTO tntbl5 VALUES (60, 'awefaAW#');
WARNING:  file_fdw is ignored as an insert target because it does not support modification
WARNING:  file_fdw is ignored as an insert target because it does not support modification
ERROR:  No child node support modification.
--Testcase 49:
SELECT * FROM tntbl5 ORDER BY 1;
 c1 |  c2  |  __spd_url   
----+------+--------------
 10 | test | /file_svr/
 40 | foo1 | /file_svr_2/
(2 rows)

--Testcase 50:
INSERT INTO tntbl5 VALUES (61, 'AEFA');
WARNING:  file_fdw is ignored as an insert target because it does not support modification
WARNING:  file_fdw is ignored as an insert target because it does not support modification
ERROR:  No child node support modification.
--Testcase 51:
SELECT * FROM tntbl5 ORDER BY 1;
 c1 |  c2  |  __spd_url   
----+------+--------------
 10 | test | /file_svr/
 40 | foo1 | /file_svr_2/
(2 rows)

--Testcase 52:
INSERT INTO tntbl5 VALUES (62, 'e4rw3fr');
WARNING:  file_fdw is ignored as an insert target because it does not support modification
WARNING:  file_fdw is ignored as an insert target because it does not support modification
ERROR:  No child node support modification.
--Testcase 53:
SELECT * FROM tntbl5 ORDER BY 1;
 c1 |  c2  |  __spd_url   
----+------+--------------
 10 | test | /file_svr/
 40 | foo1 | /file_svr_2/
(2 rows)

--Testcase 54:
INSERT INTO tntbl5 VALUES (63, 'sreg32sf aef');
WARNING:  file_fdw is ignored as an insert target because it does not support modification
WARNING:  file_fdw is ignored as an insert target because it does not support modification
ERROR:  No child node support modification.
--Testcase 55:
SELECT * FROM tntbl5 ORDER BY 1;
 c1 |  c2  |  __spd_url   
----+------+--------------
 10 | test | /file_svr/
 40 | foo1 | /file_svr_2/
(2 rows)

--Testcase 56:
INSERT INTO tntbl5 VALUES (64, 'sgwegaw3');
WARNING:  file_fdw is ignored as an insert target because it does not support modification
WARNING:  file_fdw is ignored as an insert target because it does not support modification
ERROR:  No child node support modification.
--Testcase 57:
SELECT * FROM tntbl5 ORDER BY 1;
 c1 |  c2  |  __spd_url   
----+------+--------------
 10 | test | /file_svr/
 40 | foo1 | /file_svr_2/
(2 rows)

--Testcase 58:
INSERT INTO tntbl5 VALUES (65, 'a3rq2raeff');
WARNING:  file_fdw is ignored as an insert target because it does not support modification
WARNING:  file_fdw is ignored as an insert target because it does not support modification
ERROR:  No child node support modification.
--Testcase 59:
SELECT * FROM tntbl5 ORDER BY 1;
 c1 |  c2  |  __spd_url   
----+------+--------------
 10 | test | /file_svr/
 40 | foo1 | /file_svr_2/
(2 rows)

-- Multi insert to nodes
--Testcase 60:
INSERT INTO tntbl5 VALUES (66, 'awefaAW#'), (67, '42342q');
WARNING:  file_fdw is ignored as an insert target because it does not support modification
WARNING:  file_fdw is ignored as an insert target because it does not support modification
ERROR:  No child node support modification.
--Testcase 61:
SELECT * FROM tntbl5 ORDER BY 1;
 c1 |  c2  |  __spd_url   
----+------+--------------
 10 | test | /file_svr/
 40 | foo1 | /file_svr_2/
(2 rows)

--Testcase 62:
INSERT INTO tntbl5 VALUES (68, 'w3r3wrfa#'), (69, '32423'), (70, 'agaw'), (71, 'seg3agawega'), (72, 'rj34yerg');
WARNING:  file_fdw is ignored as an insert target because it does not support modification
WARNING:  file_fdw is ignored as an insert target because it does not support modification
ERROR:  No child node support modification.
--Testcase 63:
SELECT * FROM tntbl5 ORDER BY 1;
 c1 |  c2  |  __spd_url   
----+------+--------------
 10 | test | /file_svr/
 40 | foo1 | /file_svr_2/
(2 rows)

--
-- Test in case of throw_candidate_error = true
-- If at least one child node has an error, pgspider_core_fdw raises an error
--Testcase 64:
SET pgspider_core_fdw.throw_candidate_error = true;
ALTER FOREIGN TABLE tntbl5__file_svr__0 OPTIONS (SET filename '/tmp/pg_modify_file_not_existed.csv');
-- Insert single value
--Testcase 65:
INSERT INTO tntbl5 VALUES (80, 'A#KRA#');
WARNING:  file_fdw is ignored as an insert target because it does not support modification
WARNING:  file_fdw is ignored as an insert target because it does not support modification
ERROR:  No child node support modification.
--Testcase 66:
SELECT * FROM tntbl5 ORDER BY 1;
ERROR:  PGSpider fail to iterate tuple from child thread
 DETAIL: could not open file "/tmp/pg_modify_file_not_existed.csv" for reading: No such file or directory
ALTER FOREIGN TABLE tntbl5__file_svr__0 OPTIONS (SET filename '/tmp/pg_modify_file1.csv');
--Testcase 67:
INSERT INTO tntbl5 VALUES ('81', '2ea3r2');
WARNING:  file_fdw is ignored as an insert target because it does not support modification
WARNING:  file_fdw is ignored as an insert target because it does not support modification
ERROR:  No child node support modification.
--Testcase 68:
SELECT * FROM tntbl5 ORDER BY 1;
 c1 |  c2  |  __spd_url   
----+------+--------------
 10 | test | /file_svr/
 40 | foo1 | /file_svr_2/
(2 rows)

--Testcase 69:
INSERT INTO tntbl5 VALUES (82, 42452);
WARNING:  file_fdw is ignored as an insert target because it does not support modification
WARNING:  file_fdw is ignored as an insert target because it does not support modification
ERROR:  No child node support modification.
--Testcase 70:
SELECT * FROM tntbl5 ORDER BY 1;
 c1 |  c2  |  __spd_url   
----+------+--------------
 10 | test | /file_svr/
 40 | foo1 | /file_svr_2/
(2 rows)

--Testcase 71:
INSERT INTO tntbl5 VALUES (83, '32r21rawf');
WARNING:  file_fdw is ignored as an insert target because it does not support modification
WARNING:  file_fdw is ignored as an insert target because it does not support modification
ERROR:  No child node support modification.
--Testcase 72:
SELECT * FROM tntbl5 ORDER BY 1;
 c1 |  c2  |  __spd_url   
----+------+--------------
 10 | test | /file_svr/
 40 | foo1 | /file_svr_2/
(2 rows)

--Testcase 73:
INSERT INTO tntbl5 VALUES (84, 'A#afwf#');
WARNING:  file_fdw is ignored as an insert target because it does not support modification
WARNING:  file_fdw is ignored as an insert target because it does not support modification
ERROR:  No child node support modification.
--Testcase 74:
SELECT * FROM tntbl5 ORDER BY 1;
 c1 |  c2  |  __spd_url   
----+------+--------------
 10 | test | /file_svr/
 40 | foo1 | /file_svr_2/
(2 rows)

--Testcase 75:
INSERT INTO tntbl5 VALUES (85, 'a3r2e');
WARNING:  file_fdw is ignored as an insert target because it does not support modification
WARNING:  file_fdw is ignored as an insert target because it does not support modification
ERROR:  No child node support modification.
--Testcase 76:
SELECT * FROM tntbl5 ORDER BY 1;
 c1 |  c2  |  __spd_url   
----+------+--------------
 10 | test | /file_svr/
 40 | foo1 | /file_svr_2/
(2 rows)

-- Insert multi value
--Testcase 77:
INSERT INTO tntbl5 VALUES ('86', '3wra'), (87, 452);
WARNING:  file_fdw is ignored as an insert target because it does not support modification
WARNING:  file_fdw is ignored as an insert target because it does not support modification
ERROR:  No child node support modification.
--Testcase 78:
SELECT * FROM tntbl5 ORDER BY 1;
 c1 |  c2  |  __spd_url   
----+------+--------------
 10 | test | /file_svr/
 40 | foo1 | /file_svr_2/
(2 rows)

--Testcase 79:
INSERT INTO tntbl5 VALUES (88, '3wra'), (89, 'taw35ta'), (90, 'erfawfa'), (91, 'avaewvaf'), (92, 'avAEGAWRG'), (93, 'AMEF_awe.fawlfe');
WARNING:  file_fdw is ignored as an insert target because it does not support modification
WARNING:  file_fdw is ignored as an insert target because it does not support modification
ERROR:  No child node support modification.
--Testcase 80:
SELECT * FROM tntbl5 ORDER BY 1;
 c1 |  c2  |  __spd_url   
----+------+--------------
 10 | test | /file_svr/
 40 | foo1 | /file_svr_2/
(2 rows)

-- Test case bulk insert, 2 nodes file_fdw
--
-- Manual config: batch_size server = 4, batch_size table = 5, batch_size of FDW = 10, insert 20 records
-- file_fdw not support batch_size
--Testcase 41:
-- ALTER SERVER pgspider_svr OPTIONS (ADD batch_size '4');
--Testcase 42:
INSERT INTO tntbl5
	SELECT id, to_char(id, 'FM00000') FROM generate_series(36, 55) id;
WARNING:  file_fdw is ignored as an insert target because it does not support modification
WARNING:  file_fdw is ignored as an insert target because it does not support modification
ERROR:  No child node support modification.
--Testcase 43:
SELECT * FROM tntbl5 ORDER BY 1;
 c1 |  c2  |  __spd_url   
----+------+--------------
 10 | test | /file_svr/
 40 | foo1 | /file_svr_2/
(2 rows)

-- Auto config: batch_size of FDW = 10, insert 30 records
--Testcase 44:
-- ALTER SERVER pgspider_svr OPTIONS (DROP batch_size);
--Testcase 45:
INSERT INTO tntbl5
	SELECT id, to_char(id, 'FM00000') FROM generate_series(56, 85) id;
WARNING:  file_fdw is ignored as an insert target because it does not support modification
WARNING:  file_fdw is ignored as an insert target because it does not support modification
ERROR:  No child node support modification.
--Testcase 46:
SELECT * FROM tntbl5 ORDER BY 1;
 c1 |  c2  |  __spd_url   
----+------+--------------
 10 | test | /file_svr/
 40 | foo1 | /file_svr_2/
(2 rows)

--Clean
--Testcase 29:
DROP FOREIGN TABLE tntbl5 CASCADE;
--Testcase 30:
DROP USER MAPPING FOR CURRENT_USER SERVER pgspider_svr;
--Testcase 31:
DROP EXTENSION file_fdw CASCADE;
NOTICE:  drop cascades to 4 other objects
DETAIL:  drop cascades to server file_svr
drop cascades to foreign table tntbl5__file_svr__0
drop cascades to server file_svr_2
drop cascades to foreign table tntbl5__file_svr__2
--Testcase 32:
DROP SERVER pgspider_svr CASCADE;
--Testcase 33:
DROP EXTENSION pgspider_core_fdw CASCADE;
